key	keyword	definition	description	source
Written by	write	"Writing is a medium of human communication that involves the representation of a language with symbols. While not all languages utilize a writing system, those with systems of inscriptions can complement and extend capacities of spoken language by enabling the creation of durable forms of speech that can be transmitted across space and stored over time . It has also been observed that the activity of writing itself can have knowledge-transforming effects, since it allows humans to externalize their thinking in forms that are easier to reflect on and potentially rework. Writing systems are not themselves human languages but are means of rendering a language in a readable form. Writing relies on many of the same semantic structures as the speech it represents, such as lexicon and syntax, with the added dependency of a system of symbols to represent that language's phonology and morphology. The result of the activity of writing is called a text , and the interpreter or activator of this text is called a reader. As human societies emerged, collective motivations for the development of writing were driven by pragmatic exigencies like keeping history, maintaining culture, codifying knowledge through curricula and lists of texts deemed to contain foundational knowledge or to be artistically exceptional , organizing and governing societies through the formation of legal systems, census records, contracts, deeds of ownership, taxation, trade agreements, treaties, and so on. For H.G. Wells, writing ""made the growth of states larger than the old city states possible. It made a continuous historical consciousness possible. The command of the priest or king and his seal could go far beyond his sight and voice and could survive his death"". For example, around the 4th millennium BC, the complexity of trade and administration in Mesopotamia outgrew human memory, and writing became a more dependable method of recording and presenting transactions in a permanent form. In both ancient Egypt and Mesoamerica, on the other hand, writing may have evolved through calendric and political necessities for recording historical and environmental events. Individual motivations for writing include improvised additional capacity for the limitations of human memory , dissemination of ideas , imaginative narratives and other forms of storytelling, personal or business correspondence, and lifewriting ."	representation of language in a textual medium; tool developed by human society	wikipedia
Written by	written	produce a literary work	write, compose, pen, indite	wordnet
Written by	write	Writes are motivated by the goal of communicates	NA	GenericsKB
Published by	publish	"Publishing is the activity of making information, literature, music, software and other content available to the public for sale or for free. Traditionally, the term refers to the distribution of printed works, such as books, newspapers, and magazines. With the advent of digital information systems, the scope has expanded to include electronic publishing such as ebooks, academic journals, micropublishing, websites, blogs, video game publishing, and the like. Publishing may produce private, club, commons or public goods and may be conducted as a commercial, public, social or community activity. The commercial publishing industry ranges from large multinational conglomerates such as RELX, Pearson and Thomson Reuters to thousands of small independents. It has various divisions such as: trade/retail publishing of fiction and non- fiction, educational publishing and academic and scientific publishing. Publishing is also undertaken by governments, civil society and private companies for administrative or compliance requirements, business, research, advocacy or public interest objectives. This can include annual reports, research reports, market research, policy briefings and technical reports. Self-publishing has become very common. "" Publisher "" can refer to a publishing company or organization, an individual who leads a publishing company or an imprint, or to an individual who leads a periodical."	process of production and dissemination of literature, music, or information	wikipedia
Published by	published	formally made public	promulgated, published	wordnet
Published by	published	prepare and issue (a book, journal, or piece of music) for public sale.	NA	owlbot
English publisher	english	British may refer to:	Wikimedia disambiguation page	wikipedia
English publisher	publisher	"Publishing is the activity of making information, literature, music, software and other content available to the public for sale or for free. Traditionally, the term refers to the distribution of printed works, such as books, newspapers, and magazines. With the advent of digital information systems, the scope has expanded to include electronic publishing such as ebooks, academic journals, micropublishing, websites, blogs, video game publishing, and the like. Publishing may produce private, club, commons or public goods and may be conducted as a commercial, public, social or community activity. The commercial publishing industry ranges from large multinational conglomerates such as RELX, Pearson and Thomson Reuters to thousands of small independents. It has various divisions such as: trade/retail publishing of fiction and non- fiction, educational publishing and academic and scientific publishing. Publishing is also undertaken by governments, civil society and private companies for administrative or compliance requirements, business, research, advocacy or public interest objectives. This can include annual reports, research reports, market research, policy briefings and technical reports. Self-publishing has become very common. "" Publisher "" can refer to a publishing company or organization, an individual who leads a publishing company or an imprint, or to an individual who leads a periodical."	process of production and dissemination of literature, music, or information	wikipedia
English publisher	english	an Indo-European language belonging to the West Germanic branch; the official language of Britain and the United States and most of the commonwealth countries	English, English_language	wordnet
English publisher	publisher	the proprietor of a newspaper	publisher, newspaper_publisher	wordnet
English publisher	publisher	Publishers are in the business of publishing books	NA	GenericsKB
Demographic	demographic	Demography is the statistical study of populations, especially human beings. Demographic analysis can cover whole societies or groups defined by criteria such as education, nationality, religion, and ethnicity. Educational institutions usually treat demography as a field of sociology, though there are a number of independent demography departments. Based on the demographic research of the earth, earth's population up to the year 2050 and 2100 can be estimated by demographers. Formal demography limits its object of study to the measurement of population processes, while the broader field of social demography or population studies also analyses the relationships between economic, social, cultural, and biological processes influencing a population.	science that deals with populations and their structures statistically and theoretically with the development	wikipedia
Demographic	demographic	a statistic characterizing human populations (or segments of human populations broken down by age or sex or income etc.)	demographic	wordnet
Demographic	demographic	relating to the structure of populations.	NA	owlbot
Demographic	demographic	Demographics are statistics	NA	GenericsKB
Magazine	magazine	A magazine is a periodical publication which is printed in gloss-coated and matte paper or electronically published . Magazines are generally published on a regular schedule and contain a variety of content. They are generally financed by advertising, by a purchase price, by prepaid subscriptions, or a combination of the three.	publication type	wikipedia
Magazine	magazine	a business firm that publishes magazines	magazine, magazine_publisher	wordnet
Magazine	magazine	a periodical publication containing articles and illustrations, often on a particular subject or aimed at a particular readership.	NA	owlbot
Magazine	magazine	Magazine is a instrumentality	NA	GenericsKB
Original run	original	"Originality is the aspect of created or invented works as being new or novel, and thus distinguishable from reproductions, clones, forgeries, or derivative works. An original work is one not received from others nor one copied from or based upon the work of others.. It is a work created with a unique style and substance. The term ""originality"" is often applied as a compliment to the creativity of artists, writers, and thinkers. The modern idea of originality is tied to Romanticism, by a notion that is often called romantic originality. The concept of originality is culturally contingent. At the time of Shakespeare, it was more common to appreciate the similarity with an admired classical work, and Shakespeare himself avoided ""unnecessary invention"". It wasn't until the start of the 18th century that the concept of originality became an ideal in Western culture."	aspect of created or invented works as being new or novel, and thus distinguishable from reproductions, clones, forgeries, or derivative works	wikipedia
Original run	run	Air ACT , legally ACT Airlines and formerly branded as myCargo Airlines , is a Turkish cargo airline based in Kurtköy, Istanbul	cargo airline	wikipedia
Original run	original	not derived or copied or translated from something else	original	wordnet
Original run	run	an unbroken series of events	streak, run	wordnet
Original run	original	Originals are models	NA	GenericsKB
Original run	run	Runs are damage	NA	GenericsKB
Volumes	volumes	Volume is the quantity of three-dimensional space enclosed by a closed surface, for example, the space that a substance or shape occupies or contains. Volume is often quantified numerically using the SI derived unit, the cubic metre. The volume of a container is generally understood to be the capacity of the container; i. e., the amount of fluid that the container could hold, rather than the amount of space the container itself displaces. Three dimensional mathematical shapes are also assigned volumes. Volumes of some simple shapes, such as regular, straight-edged, and circular shapes can be easily calculated using arithmetic formulas. Volumes of complicated shapes can be calculated with integral calculus if a formula exists for the shape's boundary. One-dimensional figures and two-dimensional shapes are assigned zero volume in the three-dimensional space. The volume of a solid can be determined by fluid displacement. Displacement of liquid can also be used to determine the volume of a gas. The combined volume of two substances is usually greater than the volume of just one of the substances. However, sometimes one substance dissolves in the other and in such cases the combined volume is not additive. In differential geometry , volume is expressed by means of the volume form, and is an important global Riemannian invariant. In thermodynamics , volume is a fundamental parameter, and is a conjugate variable to pressure.	quantity of three-dimensional space	wikipedia
Volumes	volumes	a publication that is one of a set of several similar publications	volume	wordnet
Volumes	volumes	the amount of space that a substance or object occupies, or that is enclosed within a container.	NA	owlbot
Volumes	volume	Volume also affects time and price	NA	GenericsKB
