key	keyword	definition	description	source
Born	born	""" Born "" is a song written and performed by Barry Gibb that was included as the first track on his debut album The Kid's No Good in 1970"	song written and performed by Barry Gibb	wikipedia
Born	born	bring forth,	bear, turn_out	wordnet
Born	born	existing as a result of birth.	NA	owlbot
Born	born	Borns start with cries	NA	GenericsKB
Died	died	Death is the permanent cessation of all biological functions that sustain a living organism. Phenomena which commonly bring about death include aging, physiological or organ failure, predation, poisoning, malnutrition, disease, suicide, homicide, asphyxia, drowning, severe burns, drug intoxication, starvation, dehydration, electrocution, intense heat or cold, radiation toxicity, warfare attacks such as bombings, as well as explosions and accidents or major trauma resulting in fatal injury. The remains of a living organism begin to decompose shortly after death. It is an inevitable process eventually occurring in all living organisms. As of the early 21st century, over 150,000 humans die each day. Death, particularly of humans, has commonly been considered a sad or unpleasant occasion, due to the affection for the deceased and the termination of social and familial bonds. Other concerns include fear of death, necrophobia, anxiety, sorrow, grief, emotional pain, depression, sympathy, compassion, solitude, or saudade. Many cultures and religions have the idea of an afterlife, and also hold the idea of judgement and reward for good deeds or punishment for sin.	permanent cessation of vital functions	wikipedia
Died	died	pass from physical life and lose all bodily attributes and functions necessary to sustain life	die, decease, perish, go, exit, pass_away, expire, pass, kick_the_bucket, cash_in_one's_chips, buy_the_farm, conk, give-up_the_ghost, drop_dead, pop_off, choke, croak, snuff_it	wordnet
Died	died	(of a person, animal, or plant) stop living.	NA	owlbot
Died	die	Dies  dreams	NA	GenericsKB
Cause of death	cause of death	"In law, medicine, and statistics, cause of death is an official determination of conditions resulting in a human's death, which may be recorded on a death certificate. A cause of death is determined by a medical examiner. The cause of death is a specific disease or injury, in contrast to the manner of death which is a small number of categories like ""natural"", ""accident"", and ""homicide"", which have different legal implications. International Classification of Disease codes are often used to record manner and cause of death in a systematic way that makes it easy to compile statistics and more feasible to compare events across jurisdictions."	conditions resulting in a death	wikipedia
Cause of death	cause	any entity that produces an effect or is responsible for events or results	causal_agent, cause, causal_agency	wordnet
Cause of death	death	the event of dying or departure from life	death, decease, expiry	wordnet
Cause of death	cause of death	Cause of death has to do with determining which disease or injury actually caused death	NA	GenericsKB
Burial place	burial place	These lists of cemeteries compile notable cemeteries, mausolea, and other places people are buried worldwide. Reasons for notability include their design, their history, and their interments.	Wikimedia list article	wikipedia
Burial place	burial	the ritual placing of a corpse in a grave	burial, entombment, inhumation, interment, sepulture	wordnet
Burial place	place	the post or function properly or customarily occupied or served by another	stead, position, place, lieu	wordnet
Burial place	burial	Burial is a funeral	NA	GenericsKB
Burial place	place	Place arrowheads on all light rays in order to show which direction they are moving	NA	GenericsKB
Nationality	nationality	Nationality is a legal relationship between an individual person and a state. Nationality affords the state jurisdiction over the person and affords the person the protection of the state. What these rights and duties are varies from state to state. This relationship generally enables intervention by a State to provide help and protection to its nationals when they are harmed by other States. By custom and international conventions, it is the right of each state to determine who its nationals are. Such determinations are part of nationality law. In some cases, determinations of nationality are also governed by public international law—for example, by treaties on statelessness and the European Convention on Nationality. Nationality differs technically and legally from citizenship, which is a different legal relationship between a person and a country. The noun national can include both citizens and non-citizens. The most common distinguishing feature of citizenship is that citizens have the right to participate in the political life of the state, such as by voting or standing for election. However, in most modern countries all nationals are citizens of the state, and full citizens are always nationals of the state. In older texts the word nationality , rather than ethnicity , is often used to refer to an ethnic group . This older meaning of nationality is not defined by political borders or passport ownership and includes nations that lack an independent state . Individuals may also be considered nationals of groups with autonomous status that have ceded some power to a larger government.	relationship between an individual human and a state	wikipedia
Nationality	nationality	the status of belonging to a particular nation by birth or naturalization	nationality	wordnet
Nationality	nationality	an ethnic group forming a part of one or more political nations.	NA	owlbot
Nationality	nationality	A nationality is a people	NA	GenericsKB
Occupation	occupation	Employment is a relationship between two parties, usually based on a contract where work is paid for, where one party, which may be a corporation, for profit, not-for-profit organization, co-operative or other entity is the employer and the other is the employee	relationship between the employee and the employer	wikipedia
Occupation	occupation	any activity that occupies a person's attention	occupation	wordnet
Occupation	occupation	for the sole use of the occupiers of the land concerned.	NA	owlbot
Occupation	occupation	An occupation is an activity	NA	GenericsKB
Years active	year	A year is the orbital period of a planetary body, for example, the Earth, moving in its orbit around the Sun. Due to the Earth's axial tilt, the course of a year sees the passing of the seasons, marked by change in weather, the hours of daylight, and, consequently, vegetation and soil fertility. In temperate and subpolar regions around the planet, four seasons are generally recognized: spring, summer, autumn and winter. In tropical and subtropical regions, several geographical sectors do not present defined seasons; but in the seasonal tropics, the annual wet and dry seasons are recognized and tracked. A calendar year is an approximation of the number of days of the Earth's orbital period, as counted in a given calendar. The Gregorian calendar, or modern calendar, presents its calendar year to be either a common year of 365 days or a leap year of 366 days, as do the Julian calendars; see below. For the Gregorian calendar, the average length of the calendar year across the complete leap cycle of 400 years is 365.2425 days. The ISO standard ISO 80000-3, Annex C, supports the symbol a to represent a year of either 365 or 366 days. In English, the abbreviations y and yr are commonly used. In astronomy, the Julian year is a unit of time; it is defined as 365.25 days of exactly 86,400 seconds , totalling exactly 31,557,600 seconds in the Julian astronomical year. The word year is also used for periods loosely associated with, but not identical to, the calendar or astronomical year, such as the seasonal year, the fiscal year, the academic year, etc. Similarly, year can mean the orbital period of any planet; for example, a Martian year and a Venusian year are examples of the time a planet takes to transit one complete orbit. The term can also be used in reference to any long period or cycle, such as the Great Year.	estimated period of time for the Earth's orbit around the Sun and observed at a fixed geographic point, lasting about 365.25 days on average to the nearest half day; base later modified to define or adjust various calendars	wikipedia
Years active	years	a late time of life	old_age, years, age, eld, geezerhood	wordnet
Years active	active	tending to become more severe or wider in scope	active	wordnet
Years active	year	Year is the epoch at which the magnetic field is evaluated for trapped proton calculations	NA	GenericsKB
Years active	active	Actives are people	NA	GenericsKB
Organization	organization	An organization or organisation is an entity, such as a company, an institution, or an association, comprising one or more people and having a particular purpose. The word is derived from the Greek word organon , which means tool or instrument, musical instrument, and organ.	social entity (not necessarily commercial) uniting people into a structured group managing shared means to meet some needs, or to pursue collective goals	wikipedia
Organization	organization	an ordered manner; orderliness by virtue of being methodical and well organized	organization, organisation, system	wordnet
Organization	organization	an organized group of people with a particular purpose, such as a business or government department.	NA	owlbot
Organization	organization	Organization is a group of investors who meet to discuss the markets and invest as a group	NA	GenericsKB
Notable work	notable	Notability is the property of being worthy of notice, having fame, or being considered to be of a high degree of interest, significance, or distinction. It also refers to the capacity to be such. Persons who are notable due to public responsibility, accomplishments, or, even, mere participation in the celebrity industry are said to have a public profile.	property of being worthy of notice, or being considered to be of a high degree of interest or significance	wikipedia
Notable work	work	A creative work is a manifestation of creative effort including fine artwork , dance, writing , filmmaking, and composition	distinct artistic creation such as artwork, literature, music, and paintings	wikipedia
Notable work	notable	worthy of notice	noteworthy, notable	wordnet
Notable work	work	the occupation for which you are paid	employment, work	wordnet
Notable work	work	Work affects family because the same people who play work roles also play family roles	NA	GenericsKB
Home town	home town	Andrew William Burrows is an English songwriter and musician	English musician	wikipedia
Home town	home	housing that someone is living in	dwelling, home, domicile, abode, habitation, dwelling_house	wordnet
Home town	town	an administrative division of a county	township, town	wordnet
Home town	home town	the town of one's birth or early life or present fixed residence.	NA	owlbot
Home town	home	Home based businesses are the fastest growing segment of business inthe United States	NA	GenericsKB
Home town	town	A town is a municipality	NA	GenericsKB
