key	keyword	definition	description	source
Born	born	""" Born "" is a song written and performed by Barry Gibb that was included as the first track on his debut album The Kid's No Good in 1970"	song written and performed by Barry Gibb	wikipedia
Born	born	cause to be born	give_birth, deliver, bear, birth, have	wordnet
Born	born	existing as a result of birth.	NA	owlbot
Born	born	Borns start with cries	NA	GenericsKB
Birth Name	birth name	The birth name is the name of the person given upon their birth. The term may be applied to the surname, the given name or to the entire name. Where births are required to be officially registered, the entire name entered onto a births register or birth certificate may by that fact alone become the person's legal name. The assumption in the Western world is often that the name from birth will persist to adulthood in the normal course of affairs—either throughout life, or until marriage. Some possible changes concern middle names, diminutive forms, changes relating to parental status , and changes related to gender transition. Matters are very different in some cultures in which a birth name is for childhood only, rather than for life.	last name acquired at birth or (in some jurisdictions) at least otherwise than by marriage	wikipedia
Birth Name	birth	the kinship relation of an offspring to the parents	parentage, birth	wordnet
Birth Name	birth	give birth to (a baby or other young).	NA	owlbot
Birth Name	birth	Birth begins the human clock	NA	GenericsKB
Political party	political party	A political party is an organized group of people who have the same ideology, or who otherwise have the same political positions, and who field candidates for elections, in an attempt to get them elected and thereby implement the party's agenda. They are a defining element of representative democracy. While there is some international commonality in the way political parties are recognized and in how they operate, there are often many differences, and some are significant. Most of political parties have an ideological core, but some do not, and many represent ideologies very different from their ideology at the time the party was founded. Many countries, such as Germany and India, have several significant political parties, and some nations have one-party systems, such as China and Cuba. The United States is in practice a two-party system but with many smaller parties also participating.	organization that seeks to influence government policy and actions	wikipedia
Political party	political	involving or characteristic of politics or parties or politicians; - Daniel Goleman	political	wordnet
Political party	party	a person involved in legal proceedings	party	wordnet
Political party	political party	A political party is an organization	NA	GenericsKB
Spouse(s)	spouse	A spouse is a significant other in a marriage, civil union, or common-law marriage. The term is gender neutral, whereas a male spouse is a husband and a female spouse is a wife. Although a spouse is a form of significant other, the latter term also includes non-marital partners who play a social role similar to that of a spouse, but do not have rights and duties reserved by law to a spouse.	partner in a marriage, civil union, domestic partnership or common-law marriage	wikipedia
Spouse(s)	spouse	a person's partner in marriage	spouse, partner, married_person, mate, better_half	wordnet
Spouse(s)	spouse	a husband or wife, considered in relation to their partner.	NA	owlbot
Spouse(s)	spouse	A spouse is a relative	NA	GenericsKB
Children	children	"Biologically, a child is a human being between the stages of birth and puberty, or between the developmental period of infancy and puberty. The legal definition of child generally refers to a minor, otherwise known as a person younger than the age of majority. Children generally have fewer rights and less responsibility than adults. They are classed as unable to make serious decisions, and legally must be under the care of their parents or another responsible caregiver. Child may also describe a relationship with a parent or, metaphorically, an authority figure, or signify group membership in a clan, tribe, or religion; it can also signify being strongly affected by a specific time, place, or circumstance, as in ""a child of nature"" or ""a child of the Sixties""."	human between the stages of birth and puberty	wikipedia
Children	children	a member of a clan or tribe	child	wordnet
Children	children	a young human being below the age of puberty or below the legal age of majority.	NA	owlbot
Children	child	A child is a person	NA	GenericsKB
Parents	parents	"A parent is a caregiver of the offspring in their own species. In humans, a parent is the caretaker of a child . A biological parent is a person whose gamete resulted in a child, a male through the sperm, and a female through the ovum. Biological parents are first-degree relatives and have 50% genetic meet. A female can also become a parent through surrogacy. Some parents may be adoptive parents, who nurture and raise an offspring, but are not biologically related to the child. Orphans without adoptive parents can be raised by their grandparents or other family members. A parent can also be elaborated as an ancestor removed one generation. With recent medical advances, it is possible to have more than two biological parents. Examples of third biological parents include instances involving surrogacy or a third person who has provided DNA samples during an assisted reproductive procedure that has altered the recipients' genetic material. The most common types of parents are mothers, fathers, step-parents, and grandparents. A mother is, ""a woman in relation to a child or children to whom she has given birth."" The extent to which it is socially acceptable for a parent to be involved in their offspring's life varies from culture to culture, however one that exhibits too little involvement is sometimes said to exhibit child neglect, while one that is too involved is sometimes said to be overprotective, cosseting, nosey, or intrusive."	individual who sired or gave birth to oneself, caregiver of said offspring of their own species	wikipedia
Parents	parents	a father or mother; one who begets or one who gives birth to or nurtures and raises a child; a relative who plays the role of guardian	parent	wordnet
Parents	parents	a person's father or mother.	NA	owlbot
Parents	parent	A parent is a genitor	NA	GenericsKB
Education	education	Education is the process of facilitating learning, or the acquisition of knowledge, skills, values, beliefs, and habits. Educational methods include teaching, training, storytelling, discussion and directed research. Education frequently takes place under the guidance of educators, however learners can also educate themselves. Education can take place in formal or informal settings and any experience that has a formative effect on the way one thinks, feels, or acts may be considered educational. The methodology of teaching is called pedagogy. Formal education is commonly divided formally into such stages as preschool or kindergarten, primary school, secondary school and then college, university, or apprenticeship. A right to education has been recognized by some governments and the United Nations. In most regions, education is compulsory up to a certain age. There is a movement for education reform, and in particular for evidence-based education.	learning in which knowledge and skills are transferred through teaching	wikipedia
Education	education	the gradual process of acquiring knowledge	education	wordnet
Education	education	an enlightening experience.	NA	owlbot
Education	education	Education aims at the person who makes the value of the individual important	NA	GenericsKB
Net worth	net worth	Net worth is the value of all the non-financial and financial assets owned by an institutional unit or sector minus the value of all its outstanding liabilities. Since financial assets minus outstanding liabilities equal net financial assets, net worth can also be conveniently expressed as non- financial assets plus net financial assets. It can apply to companies, individuals, governments or economic sectors such as the sector of financial corporations or to entire countries.	total assets minus total outside liabilities of an individual or a company	wikipedia
Net worth	net	the excess of revenues over outlays in a given period of time (including depreciation and other non-cash expenses)	net_income, net, net_profit, lucre, profit, profits, earnings	wordnet
Net worth	worth	the quality that renders something desirable or valuable or useful	worth	wordnet
Net worth	net worth	Net worth is a person's total assets minus their total debts	NA	GenericsKB
Website	website	A website is a collection of web pages and related content that is identified by a common domain name and published on at least one web server. Notable examples are wikipedia.org, google.com, and amazon.com. All publicly accessible websites collectively constitute the World Wide Web. There are also private websites that can only be accessed on a private network, such as a company's internal website for its employees. Websites are typically dedicated to a particular topic or purpose, such as news, education, commerce, entertainment, or social networking. Hyperlinking between web pages guides the navigation of the site, which often starts with a home page. Users can access websites on a range of devices, including desktops, laptops, tablets, and smartphones. The software application used on these devices is called a web browser.	set of related web pages served from a single web domain	wikipedia
Website	website	a computer connected to the internet that maintains a series of web pages on the World Wide Web	web_site, website, internet_site, site	wordnet
Website	website	A website is a computer	NA	GenericsKB
Other political affiliations	political affiliation	A political party is an organized group of people who have the same ideology, or who otherwise have the same political positions, and who field candidates for elections, in an attempt to get them elected and thereby implement the party's agenda. They are a defining element of representative democracy. While there is some international commonality in the way political parties are recognized and in how they operate, there are often many differences, and some are significant. Most of political parties have an ideological core, but some do not, and many represent ideologies very different from their ideology at the time the party was founded. Many countries, such as Germany and India, have several significant political parties, and some nations have one-party systems, such as China and Cuba. The United States is in practice a two-party system but with many smaller parties also participating.	organization that seeks to influence government policy and actions	wikipedia
Other political affiliations	political	involving or characteristic of politics or parties or politicians; - Daniel Goleman	political	wordnet
Other political affiliations	affiliations	a social or business relationship	affiliation, association, tie, tie-up	wordnet
Other political affiliations	affiliation	Affiliation is association	NA	GenericsKB
