key	keyword	definition	description	source
Chief Justice	chief justice	"The chief justice is the presiding member of a supreme court in any of many countries with a justice system based on English common law, such as the Supreme Court of Bangladesh, the Supreme Court of Canada, the Supreme Court of Singapore, the Court of Final Appeal of Hong Kong, the Supreme Court of Japan, the Supreme Court of India, the Supreme Court of Pakistan, the Supreme Court of Nigeria, the Supreme Court of Nepal, the Constitutional Court of South Africa, the Supreme Court of Ireland, the Supreme Court of New Zealand, the High Court of Australia, the Supreme Court of the United States, and provincial or state supreme courts/high courts. The situation is slightly different in the three legal jurisdictions within the United Kingdom. The courts of England and Wales are headed by the Lord Chief Justice of England and Wales; in Northern Ireland's courts, the equivalent position is the Lord Chief Justice of Northern Ireland, and in the courts of Scotland the head of the judiciary of Scotland is the Lord President of the Court of Session, who is also Lord Justice General of Scotland. These three judges are not, though, part of the Supreme Court of the United Kingdom, which operates across all three jurisdictions and is headed by the President of the Supreme Court of the United Kingdom. The chief justice can be selected in many ways, but, in many nations, the position is given to the most senior justice of the court, while, in the United States, it is often the President's most important political nomination, subject to approval by the United States Senate. Although the title of this top American jurist is, by statute, Chief Justice of the United States, the term ""Chief Justice of the Supreme Court"" is often used unofficially. In some courts, the chief justice has a different title, e.g. president of the supreme court. In other courts, the title of chief justice is used, but the court has a different name, e.g. the Supreme Court of Judicature in colonial Ceylon, and the Supreme Court of Appeals of West Virginia ."	presiding member of a supreme court	wikipedia
Chief Justice	chief	a person who is in charge	head, chief, top_dog	wordnet
Chief Justice	justice	the United States federal department responsible for enforcing federal laws (including the enforcement of all civil rights legislation); created in 1870	Department_of_Justice, Justice_Department, Justice, DoJ	wordnet
Chief Justice	chief justice	Chief justice is judges	NA	GenericsKB
Upper House	upper house	An upper house is one of two chambers of a bicameral legislature , the other chamber being the lower house. The house formally designated as the upper house is usually smaller and often has more restricted power than the lower house. A legislature composed of only one house is described as unicameral.	chamber of a bicameral legislature	wikipedia
Upper House	upper	the higher of two berths	upper_berth, upper	wordnet
Upper House	house	the members of a religious community living together	house	wordnet
Upper House	upper house	the higher house in a bicameral parliament or similar legislature.	NA	owlbot
Upper House	upper house	Upper houses are houses	NA	GenericsKB
Lower House	lower house	"A lower house is one of two chambers of a bicameral legislature, the other chamber being the upper house. Despite its official position ""below"" the upper house, in many legislatures worldwide, the lower house has come to wield more power or otherwise exert significant political influence. The lower house typically is the larger of the two chambers, i.e. its members are more numerous. A legislature composed of only one house is described as unicameral."	chamber of a bicameral legislature	wikipedia
Lower House	lower	the lower of two berths	lower_berth, lower	wordnet
Lower House	house	the audience gathered together in a theatre or cinema	house	wordnet
Lower House	lower house	the larger of two sections of a bicameral parliament or similar legislature, typically with elected members and having the primary responsibility for legislation.	NA	owlbot
Lower House	low	Lows are air mass	NA	GenericsKB
Lower House	house	House is a building	NA	GenericsKB
