key	keyword	definition	description	source
Capital and largest city	capital	Paytakht is a popular Iranian TV series portraying the life a Mazandarani family	Iranian TV comedy series	wikipedia
Capital and largest city	large	 Big, of great size	Wikimedia disambiguation page	wikipedia
Capital and largest city	city	A city is a large human settlement. It can be defined as a permanent and densely settled place with administratively defined boundaries whose members work primarily on non-agricultural tasks. Cities generally have extensive systems for housing, transportation, sanitation, utilities, land use, and communication. Their density facilitates interaction between people, government organisations and businesses, sometimes benefiting different parties in the process, such as improving efficiency of goods and service distribution. This concentration also can have significant negative consequences, such as forming urban heat islands, concentrating pollution, and stressing water supplies and other resources. Historically, city-dwellers have been a small proportion of humanity overall, but following two centuries of unprecedented and rapid urbanisation, roughly half of the world population now lives in cities, which has had profound consequences for global sustainability. Present-day cities usually form the core of larger metropolitan areas and urban areas—creating numerous commuters traveling towards city centres for employment, entertainment, and edification. However, in a world of intensifying globalisation, all cities are to varying degrees also connected globally beyond these regions. This increased influence means that cities also have significant influences on global issues, such as sustainable development, global warming and global health. Other important traits of cities besides population include the capital status and relative continued occupation of the city. For example, country capitals such as Abu Dhabi, Beijing, Berlin, Cairo, London, Moscow, Paris, Rome, Seoul, Tokyo, Taipei, and Washington, D.C. reflect their nation's identity. Some historic capitals, such as Kyoto, maintain their reflection of cultural identity even without modern capital status. Religious holy sites offer another example of capital status within a religion, Jerusalem, Mecca, and Varanasi each hold significance. The cities of Faiyum, Damascus, and Argos are among those laying claim to the longest continual inhabitation. In terms of relative age, the oldest cities in the Americas are Cholula near Puebla, Florés in Petén, and Acoma near Albuquerque, while the oldest capital cities in the Americas are Mexico City, Santo Domingo, and San Juan. Another example of relative age, is in the age of the oldest capital cities of the superpower and emerging superpower, they are the U.S. state capital of Santa Fe, New Mexico, and the Chinese prefecture capital of Xi'an, Shaanxi.	large permanent human settlement	wikipedia
Capital and largest city	capital	a seat of government	capital	wordnet
Capital and largest city	largest	above average in size or number or quantity or magnitude or extent	large, big	wordnet
Capital and largest city	city	a large and densely populated urban area; may include several independent administrative districts	city, metropolis, urban_center	wordnet
Capital and largest city	capital	Capital also means wealth	NA	GenericsKB
Capital and largest city	large	A large is size	NA	GenericsKB
Capital and largest city	city	A city is a municipality	NA	GenericsKB
Official languages	official languages	"An official language , also called state language , is a language given a special status in a particular country, state, or other jurisdiction. Typically a country's official language refers to the language used in government . The term ""official language"" does not typically refer to the language used by a people or country, but by its government, as ""the means of expression of a people cannot be changed by any law"". 178 countries of the world recognize an official language, 101 of them recognizing more than one. The government of Italy officialised Italian only in 1999, and some nations have never declared official languages at the national level. Other nations have declared non- indigenous official languages. ""The Philippines and parts of Africa live with a peculiar cultural paradox. Although the official languages may be French or English, these are not the languages most widely spoken by residents."" Many of the world's constitutions mention one or more official or national languages. Some countries use the official language designation to empower indigenous groups by giving them access to the government in their native languages. In countries that do not formally designate an official language, a de facto national language usually evolves. English is the most common official language, with recognized status in 51 countries. Arabic, French, and Spanish are also widely recognized. ° An official language that is also an indigenous language is called endoglossic , one that is not indigenous is exoglossic. An instance is Nigeria which has three endoglossic official languages. By this the country aims to protect the indigenous languages although at the same time recognising the English language as its lingua franca."	language given special status in some polity	wikipedia
Official languages	official	a worker who holds or is invested with an office	official, functionary	wordnet
Official languages	languages	a system of words used to name things in a particular discipline	terminology, nomenclature, language	wordnet
Official languages	official	Officials are an integral part of the sport of hockey	NA	GenericsKB
Official languages	language	Language aids people in adjusting as their culture changes	NA	GenericsKB
National language	national language	"A national language is a language that has some connection—de facto or de jure—with people and the territory they occupy. There is little consistency in the use of this term. One or more languages spoken as first languages in the territory of a country may be referred to informally or designated in legislation as national languages of the country. National languages are mentioned in over 150 world constitutions. C.M.B. Brann, with particular reference to India, suggests that there are ""four quite distinctive meanings"" for national language in a polity: * ""Territorial language"" of a particular people * ""Regional language"" * ""Language-in-common or community language"" used throughout a country * ""Central language"" used by government and perhaps having a symbolic value. The last is usually given the title of official language. In some cases , several languages are designated as official and a national language is separately designated. Standard languages, such as Standard German, Standard French, and Standard Spanish, may serve as national , regional, and international languages."	language with de jure or de facto national status	wikipedia
National language	national	a person who owes allegiance to that nation	national, subject	wordnet
National language	language	a system of words used to name things in a particular discipline	terminology, nomenclature, language	wordnet
National language	national language	National language is Arabian	NA	GenericsKB
Demonym(s)	demonym	"A demonym or gentilic is a word that identifies residents or natives of a particular place, usually derived from the name of the place or that of an ethnic group. As a sub-field of anthroponymy, the study of demonyms is called demonymy or demonymics. Examples of demonyms include Cochabambino , for someone from the city of Cochabamba; American for a person from the country called the United States of America; and Swahili , for a person of the Swahili coast. Demonyms do not always clearly distinguish place of origin or ethnicity from place of residence or citizenship, and many demonyms overlap with the ethnonym for the ethnically dominant group of a region. Thus a Thai may be any resident or citizen of Thailand of any ethnic group, or more narrowly a member of the Thai people. Conversely, some groups of people may be associated with multiple demonyms. For example, a native of the United Kingdom may be called a British person , a Briton or, informally, a Brit. In some languages, a demonym may be borrowed from another language as a nickname or descriptive adjective for a group of people: for example, ""Québécois"" is commonly used in English for a native of Quebec . In English, demonyms are always capitalized. Often, they are the same as the adjectival form of the place, e.g. Egyptian , Japanese , or Greek , though significant exceptions exist; for instance, the adjectival form of Spain is ""Spanish"", but the demonym is ""Spaniards "". English commonly uses national demonyms such as ""Ethiopian"" or ""Guatemalan"", but the usage of local demonyms such as ""Chicagoan"", ""Okie"", or ""Parisian"", is rare. Many local demonyms are rarely used and many places, especially smaller towns and cities, lack a commonly used and accepted demonym altogether. Often, in practice, the demonym for states, provinces or cities is simply the name of the place, treated as an adjective; for instance, Kennewick Man, Saskatchewan Open, and New York minute, but Russia n olive, the Australia n Open, and Chin ese checkers."	name for a resident of a locality	wikipedia
Demonym(s)	demonym			wordnet
Government	government	A government is the system or group of people governing an organized community, often a state, but also other entities like for example companies, especially in the case of colonial companies. In the case of its broad associative definition, government normally consists of legislature, executive, and judiciary. Government is a means by which organizational policies are enforced, as well as a mechanism for determining policy. Each government has a kind of constitution, a statement of its governing principles and philosophy. Typically the philosophy chosen is some balance between the principle of individual freedom and the idea of absolute state authority . While all types of organizations have governance, the term government is often used more specifically, to refer to the approximately 200 independent national governments and subsidiary organizations globally. Historically prevalent forms of government include monarchy, aristocracy, timocracy, oligarchy, democracy, theocracy and tyranny. The main aspect of any philosophy of government is how political power is obtained, with the two main forms being electoral contest and hereditary succession. Libertarianism and anarchism are political ideologies that seek to limit or abolish government, finding government disruptive to self organization and freedom.	system or group of people governing an organized community, often a state	wikipedia
Government	government	the study of government of states and other political units	politics, political_science, government	wordnet
Government	government	the group of people with the authority to govern a country or state; a particular ministry in office.	NA	owlbot
Government	government	Government also carries an enormous load of social responsibility	NA	GenericsKB
Ethnic groups (2011)	ethnic groups	An ethnic group or ethnicity is a category of people who identify with each other, usually on the basis of presumed similarities such as a common language, ancestry, history, society, culture, nation or social treatment within their residing area. Ethnicity is often used synonymously with the term nation, particularly in cases of ethnic nationalism, and is separate from but related to the concept of races. Ethnicity is usually an inherited status based on the society in which one lives. Membership of an ethnic group tends to be defined by a shared cultural heritage, ancestry, origin myth, history, homeland, language or dialect, symbolic systems such as religion, mythology and ritual, cuisine, dressing style, art or physical appearance. Ethnic groups often continue to speak related languages and share a similar gene pool. By way of language shift, acculturation, adoption and religious conversion, it is sometimes possible for individuals or groups to leave one ethnic group and become part of another. The social construct that ethnic groups share a similar gene pool has been contradicted within the scientific community as evidenced by data finding more genetic variation within ethnic groups compared to between ethnic groups. The largest ethnic groups in modern times comprise more than one billion individuals each , while the smallest are limited to a few dozen individuals . Ethnic groups may be subdivided into subgroups or tribes, which over time may become separate ethnic groups themselves due to endogamy or physical isolation from the parent group. Conversely, formerly separate ethnicities can merge to form a pan-ethnicity and may eventually merge into one single ethnicity. Whether through division or amalgamation, the formation of a separate ethnic identity is referred to as ethnogenesis.	socially defined category of people who identify with each other	wikipedia
Ethnic groups (2011)	ethnic	not acknowledging the God of Christianity and Judaism and Islam	heathen, heathenish, pagan, ethnic	wordnet
Ethnic groups (2011)	groups	any number of entities (members) considered as a unit	group, grouping	wordnet
Ethnic groups (2011)	group	A group is an entity	NA	GenericsKB
Religion	religion	"Religion is a social-cultural system of designated behaviors and practices, morals, worldviews, texts, sanctified places, prophecies, ethics, or organizations, that relates humanity to supernatural, transcendental, or spiritual elements. However, there is no scholarly consensus over what precisely constitutes a religion. Different religions may or may not contain various elements ranging from the divine, sacred things, faith, a supernatural being or supernatural beings or ""some sort of ultimacy and transcendence that will provide norms and power for the rest of life"". Religious practices may include rituals, sermons, commemoration or veneration , sacrifices, festivals, feasts, trances, initiations, funerary services, matrimonial services, meditation, prayer, music, art, dance, public service, or other aspects of human culture. Religions have sacred histories and narratives, which may be preserved in sacred scriptures, and symbols and holy places, that aim mostly to give a meaning to life. Religions may contain symbolic stories, which are sometimes said by followers to be true, that have the side purpose of explaining the origin of life, the universe, and other things. Traditionally, faith, in addition to reason, has been considered a source of religious beliefs. There are an estimated 10,000 distinct religions worldwide. About 84% of the world's population is affiliated with Christianity, Islam, Hinduism, Buddhism, or some form of folk religion. The religiously unaffiliated demographic includes those who do not identify with any particular religion, atheists, and agnostics. While the religiously unaffiliated have grown globally, many of the religiously unaffiliated still have various religious beliefs. The study of religion encompasses a wide variety of academic disciplines, including theology, comparative religion and social scientific studies. Theories of religion offer various explanations for the origins and workings of religion, including the ontological foundations of religious being and belief."	sacred belief system	wikipedia
Religion	religion	a strong belief in a supernatural power or powers that control human destiny	religion, faith, religious_belief	wordnet
Religion	religion	the belief in and worship of a superhuman controlling power, especially a personal God or gods.	NA	owlbot
Religion	religion	Religion addresses moral issues	NA	GenericsKB
Emperor 	emperor	the male ruler of an empire	emperor	wordnet
Emperor 	emperor	a sovereign ruler of an empire.	NA	owlbot
Emperor 	emperor	An emperor is a sovereign	NA	GenericsKB
Crown Prince 	crown prince	A crown prince is the male heir apparent to the throne in a royal or imperial monarchy. The female form of the title is crown princess , which may refer either to an heir apparent or, especially in earlier times, to the wife of the person styled crown prince. Crown prince as a descriptive term has been used throughout history for the prince who is first-in-line to a throne and is expected to succeed , barring any unforeseen future event preventing this. In certain monarchies, a more specific substantive title may be accorded and become associated with the position of heir apparent . In these monarchies, the term crown prince may be used less often than the substantive title . Until the late twentieth century, no modern monarchy adopted a system whereby females would be guaranteed to succeed to the throne . A crown princess would therefore be more likely to refer to the spouse of a crown prince. She would be styled crown princess, not in her own right but by courtesy.	heir to the throne	wikipedia
Crown Prince 	crown	the part of a hat (the vertex) that covers the crown of the head	crown	wordnet
Crown Prince 	prince	a male member of a royal family other than the sovereign (especially the son of a sovereign)	prince	wordnet
Crown Prince 	crown prince	(in some countries) a male heir to a throne.	NA	owlbot
Crown Prince 	crown prince	A crown prince is a prince	NA	GenericsKB
Prime Minister 	prime minister	A prime minister is the head of a cabinet and the leader of the ministers in the executive branch of government, often in a parliamentary or semi- presidential system. A prime minister is not the head of state of their respective state nor a monarch, rather they are the head of government, serving typically under a monarch in a hybrid of aristocratic and democratic government forms or a president in a republican form of government. In parliamentary systems fashioned after the Westminster system, the prime minister is the presiding and actual head of government and head of the executive branch. In such systems, the head of state or their official representative usually holds a largely ceremonial position, although often with reserve powers. In many systems, the prime minister selects and may dismiss other members of the cabinet, and allocates posts to members within the government. In most systems, the prime minister is the presiding member and chairman of the cabinet. In a minority of systems, notably in semi-presidential systems of government, a prime minister is the official who is appointed to manage the civil service and execute the directives of the head of state. The prime minister is often, but not always, a member of the Legislature or the Lower House thereof and is expected with other ministers to ensure the passage of bills through the legislature. In some monarchies the monarch may also exercise executive powers that are constitutionally vested in the crown and may be exercised without the approval of parliament. As well as being head of government, being prime minister may require holding other roles or posts—the Prime Minister of the United Kingdom, for example, is also First Lord of the Treasury and Minister for the Civil Service. In some cases, prime ministers may choose to hold additional ministerial posts : during the Second World War, Winston Churchill was also Minister of Defence . Another example is the Thirty-fourth government of Israel , when Benjamin Netanyahu at one point served as the Prime Minister and those of Communications, Foreign Affairs, Regional Cooperation, Economy, Defense and Interior.	most senior minister of cabinet in the executive branch of government in a parliamentary system	wikipedia
Prime Minister 	prime	the time of maturity when power and vigor are greatest	prime, prime_of_life	wordnet
Prime Minister 	minister	a diplomat representing one government to another; ranks below ambassador	minister, diplomatic_minister	wordnet
Prime Minister 	prime minister	the head of an elected government; the principal minister of a sovereign or state.	NA	owlbot
Prime Minister 	prime minister	Some prime ministers are appointed by presidents	NA	GenericsKB
Deputy Prime Minister 	deputy prime minister	"A deputy prime minister or vice prime minister is, in some countries, a government minister who can take the position of acting prime minister when the prime minister is temporarily absent. The position is often likened to that of a vice president, as both positions are ""number two"" offices, but there are some differences. The states of Australia and provinces of Canada each have the analogous office of deputy premier. In the devolved administrations of the United Kingdom, an analogous position is that of the deputy first minister; but the position in Northern Ireland has the same powers as the First Minister. In Canada, the position of deputy prime minister should not be confused with the Canadian Deputy Minister of the Prime Minister of Canada, a nonpolitical civil servant position. A deputy prime minister traditionally serves as acting prime minister when the prime minister is temporarily absent or incapable of exercising power. The deputy prime minister is often asked to succeed to the prime minister's office following the prime minister's sudden death or unexpected resignation, but that is not necessarily mandated by the constitution. This government position is often a job that is held simultaneously with another ministry, and is usually given to one of the most senior or experienced ministers of the cabinet. The holder of this office may also be deputy leader of the governing party, or perhaps the leader of the junior party of a coalition government. Little scholarly attention has focused on deputy prime ministers, as they are sometimes less involved in the political power plays of government and more focus on the work at hand. A 2009 study in Political Science identified nine 'qualities' of deputy prime ministership: temperament; relationships with their Cabinet and caucus; relationships with their party; popularity with the public; media skills; achievements as deputy prime minister; relationship with the prime minister; leadership ambition; and method of succession. By contrast, the structure of the Government of Russia and Cabinet of Ministers of Ukraine provides for several deputy prime ministers or vice prime ministers. In the case of the Russian government, the Prime Minister is responsible for defining the scope of the duties for each of their deputies, who also may head a specific ministry: e.g. the former Minister of Finance of Russia, Alexey Kudrin, also serves as one of the deputies of the prime ministers or vice-premiers. One or two of these deputy prime ministers may hold the title of a First Deputy Prime Minister. Russian federal law indicates that in accordance with the order established in advance, one of the deputy prime ministers may temporarily substitute for the Prime Minister in their absence. Customarily, however, it is to one of the ""First"" Deputy Prime Ministers that the prime-ministerial duties may be delegated. At the same time, in the case of Prime Minister's resignation, the law allows the President of Russia to choose any of the current vice-premiers to serve as an acting Prime Minister until the confirmation of the new government."	civil servant position	wikipedia
Deputy Prime Minister 	deputy	an assistant with power to act when his superior is absent	deputy, lieutenant	wordnet
Deputy Prime Minister 	prime	the time of maturity when power and vigor are greatest	prime, prime_of_life	wordnet
Deputy Prime Minister 	minister	a diplomat representing one government to another; ranks below ambassador	minister, diplomatic_minister	wordnet
Deputy Prime Minister 	deputy	A deputy is a lawman	NA	GenericsKB
Deputy Prime Minister 	prime	Prime is adulthood	NA	GenericsKB
Deputy Prime Minister 	minister	Ministers are capable of marry couples	NA	GenericsKB
Speaker of the House of Representatives 	speaker	A loudspeaker is an electroacoustic transducer; a device which converts an electrical audio signal into a corresponding sound	electroacoustic transducer that converts an electrical audio signal into a corresponding sound	wikipedia
