key	keyword	definition	description	source
UTC time	utc	"Coordinated Universal Time is the primary time standard by which the world regulates clocks and time. It is within about 1 second of mean solar time at 0° longitude, and is not adjusted for daylight saving time. It is effectively a successor to Greenwich Mean Time . The co-ordination of time and frequency transmissions around the world began on 1 January 1960. UTC was first officially adopted as CCIR Recommendation 374, Standard-Frequency and Time-Signal Emissions , in 1963, but the official abbreviation of UTC and the official English name of Coordinated Universal Time were not adopted until 1967. The system has been adjusted several times, including a brief period where the time coordination radio signals broadcast both UTC and ""Stepped Atomic Time "" before a new UTC was adopted in 1970 and implemented in 1972. This change also adopted leap seconds to simplify future adjustments. This CCIR Recommendation 460 ""stated that carrier frequencies and time intervals should be maintained constant and should correspond to the definition of the SI second; step adjustments, when necessary, should be exactly 1 s to maintain approximate agreement with Universal Time ; and standard signals should contain information on the difference between UTC and UT."" A number of proposals have been made to replace UTC with a new system that would eliminate leap seconds. A decision whether to remove them altogether has been deferred until 2023. The current version of UTC is defined by International Telecommunications Union Recommendation , Standard-frequency and time-signal emissions , and is based on International Atomic Time with leap seconds added at irregular intervals to compensate for the slowing of the Earth's rotation. Leap seconds are inserted as necessary to keep UTC within 0.9 second of the UT1 variant of universal time. See the ""Current number of leap seconds"" section for the number of leap seconds inserted to date."	primary time standard by which the world regulates clocks and time	wikipedia
UTC time	time	"Time is the indefinite continued progress of existence and events that occur in an apparently irreversible succession from the past, through the present, into the future. It is a component quantity of various measurements used to sequence events, to compare the duration of events or the intervals between them, and to quantify rates of change of quantities in material reality or in the conscious experience. Time is often referred to as a fourth dimension, along with three spatial dimensions. Time has long been an important subject of study in religion, philosophy, and science, but defining it in a manner applicable to all fields without circularity has consistently eluded scholars. Nevertheless, diverse fields such as business, industry, sports, the sciences, and the performing arts all incorporate some notion of time into their respective measuring systems. Time in physics is operationally defined as ""what a clock reads"". Time is one of the seven fundamental physical quantities in both the International System of Units and International System of Quantities. The SI base unit of time is the second. Time is used to define other quantities – such as velocity – so defining time in terms of such quantities would result in circularity of definition. An operational definition of time, wherein one says that observing a certain number of repetitions of one or another standard cyclical event constitutes one standard unit such as the second, is highly useful in the conduct of both advanced experiments and everyday affairs of life. To describe observations of an event, a location and time are typically noted. The operational definition of time does not address what the fundamental nature of it is. It does not address why events can happen forward and backwards in space, whereas events only happen in the forward progress of time. Investigations into the relationship between space and time led physicists to define the spacetime continuum. General Relativity is the primary framework for understanding how spacetime works. Through advances in both theoretical and experimental investigations of space-time, it has been shown that time can be distorted, particularly at the edges of black holes. Temporal measurement has occupied scientists and technologists, and was a prime motivation in navigation and astronomy. Periodic events and periodic motion have long served as standards for units of time. Examples include the apparent motion of the sun across the sky, the phases of the moon, the swing of a pendulum, and the beat of a heart. Currently, the international unit of time, the second, is defined by measuring the electronic transition frequency of caesium atoms . Time is also of significant social importance, having economic value as well as personal value, due to an awareness of the limited time in each day and in human life spans."	dimension in which events can be ordered from the past through the present into the future	wikipedia
UTC time	utc	Greenwich Mean Time updated with leap seconds	coordinated_universal_time, UTC	wordnet
UTC time	time	the continuum of experience in which events pass from the future through the present to the past	time	wordnet
UTC time	time	Time affects risk perception	NA	GenericsKB
ISC event	isc	The ISC license is a permissive free software license published by the Internet Software Consortium, nowadays called Internet Systems Consortium 	lax permissive free software license	wikipedia
ISC event	event	Disambiguation note : Church and religious ceremonies can be found in the Wikipedia entries under the various religions	event of ritual significance, performed on a special occasion	wikipedia
ISC event	isc			wordnet
ISC event	event	a phenomenon that follows and is caused by some previous phenomenon	consequence, effect, outcome, result, event, issue, upshot	wordnet
ISC event	event	Event plumes associated with volcanic activity are much larger and rise higher in the water column	NA	GenericsKB
USGS-ANSS	usgs	"The United States Geological Survey is a scientific agency of the United States government. The scientists of the USGS study the landscape of the United States, its natural resources, and the natural hazards that threaten it. The organization has four major science disciplines, concerning biology, geography, geology, and hydrology. The USGS is a fact-finding research organization with no regulatory responsibility. The USGS is a bureau of the United States Department of the Interior; it is that department's sole scientific agency. The USGS employs approximately 8,670 people and is headquartered in Reston, Virginia. The USGS also has major offices near Lakewood, Colorado, at the Denver Federal Center, and Menlo Park, California. The current motto of the USGS, in use since August 1997, is ""science for a changing world"". The agency's previous slogan, adopted on the occasion of its hundredth anniversary, was ""Earth Science in the Public Service""."	scientific agency of the United States government	wikipedia
USGS-ANSS	usgs			wordnet
USGS-ANSS	anss	the part of the nervous system of vertebrates that controls involuntary actions of the smooth muscles and heart and glands	autonomic_nervous_system, ANS	wordnet
Local date	local	Local is a novel by Jaideep Varma, written in 2001 and published by Indialog Publications in 2005	book by Jaideep Varma	wikipedia
Local date	date	Chronological dating , or simply dating , is the process of attributing to an object or event a date in the past, allowing such object or event to be located in a previously established chronology	process of attributing to an object or event a date in the past	wikipedia
Local date	local	public transport consisting of a bus or train that stops at all stations or stops	local	wordnet
Local date	date	the specified day of the month	date, day_of_the_month	wordnet
Local date	local	Locals are local organizations	NA	GenericsKB
Local date	date	Date is a day	NA	GenericsKB
Local time	local time	Local mean time is a form of solar time that corrects the variations of local apparent time, forming a uniform time scale at a specific longitude	form of solar time that corrects the variations of local apparent time, forming a uniform time scale at a specific longitude	wikipedia
Local time	local	public transport consisting of a bus or train that stops at all stations or stops	local	wordnet
Local time	time	the continuum of experience in which events pass from the future through the present to the past	time	wordnet
Local time	local time	Local time is sun time as recorded on a sun dial	NA	GenericsKB
Duration	duration	In finance, the duration of a financial asset that consists of fixed cash flows, for example a bond, is the weighted average of the times until those fixed cash flows are received	NA	wikipedia
Duration	duration	the period of time during which something continues	duration, continuance	wordnet
Duration	duration	the time during which something continues.	NA	owlbot
Duration	duration	A duration is a period	NA	GenericsKB
Magnitude	magnitude	Instrumental magnitude refers to an uncalibrated apparent magnitude, and, like its counterpart, it refers to the brightness of an astronomical object seen from an observer on Earth, but unlike its counterpart, it is only useful in relative comparisons to other astronomical objects in the same image 	the uncalibrated apparent magnitude of a celestial object	wikipedia
Magnitude	magnitude	the property of relative size or extent (whether large or small)	magnitude	wordnet
Magnitude	magnitude	the degree of brightness of a star, as represented by a number on a logarithmic scale.	NA	owlbot
Magnitude	magnitude	Magnitudes are importance	NA	GenericsKB
Depth	depth	Vertical position or vertical location is a position along a vertical direction above or below a given vertical datum	NA	wikipedia
Depth	depth	the extent downward or backward or inward	depth, deepness	wordnet
Depth	depth	the distance from the top or surface to the bottom of something.	NA	owlbot
Depth	depth	Depth affects variation	NA	GenericsKB
Epicenter	epicenter	The epicenter, epicentre or epicentrum in seismology is the point on the Earth's surface directly above a hypocenter or focus, the point where an earthquake or an underground explosion originates.	point on the Earth's surface that is directly above the hypocentre or focus in an earthquake	wikipedia
Epicenter	epicenter	the point on the Earth's surface directly above the focus of an earthquake	epicenter, epicentre	wordnet
Epicenter	epicenter	the point on the earth's surface vertically above the focus of an earthquake.	NA	owlbot
Epicenter	epicenter	Epicenters are the origin of earthquakes	NA	GenericsKB
Type	type	Categorization is an activity that consists of putting things into categories based on their similarities or common criteria	cognitive process in which ideas and objects are recognized, differentiated, and understood	wikipedia
Type	type	(biology) the taxonomic group whose characteristics are used to define the next higher taxon	type	wordnet
Type	type	a design on either side of a medal or coin.	NA	owlbot
Type	type	A type is a kind	NA	GenericsKB
Areas affected	area	Area is the quantity that expresses the extent of a two-dimensional figure or shape or planar lamina, in the plane. Surface area is its analog on the two-dimensional surface of a three-dimensional object. Area can be understood as the amount of material with a given thickness that would be necessary to fashion a model of the shape, or the amount of paint necessary to cover the surface with a single coat. It is the two-dimensional analog of the length of a curve or the volume of a solid . The area of a shape can be measured by comparing the shape to squares of a fixed size. In the International System of Units , the standard unit of area is the square metre , which is the area of a square whose sides are one metre long. A shape with an area of three square metres would have the same area as three such squares. In mathematics, the unit square is defined to have area one, and the area of any other shape or surface is a dimensionless real number. There are several well-known formulas for the areas of simple shapes such as triangles, rectangles, and circles. Using these formulas, the area of any polygon can be found by dividing the polygon into triangles. For shapes with curved boundary, calculus is usually required to compute the area. Indeed, the problem of determining the area of plane figures was a major motivation for the historical development of calculus. For a solid shape such as a sphere, cone, or cylinder, the area of its boundary surface is called the surface area. Formulas for the surface areas of simple shapes were computed by the ancient Greeks, but computing the surface area of a more complicated shape usually requires multivariable calculus. Area plays an important role in modern mathematics. In addition to its obvious importance in geometry and calculus, area is related to the definition of determinants in linear algebra, and is a basic property of surfaces in differential geometry. In analysis, the area of a subset of the plane is defined using Lebesgue measure, though not every subset is measurable. In general, area in higher mathematics is seen as a special case of volume for two-dimensional regions. Area can be defined through the use of axioms, defining it as a function of a collection of certain plane figures to the set of real numbers. It can be proved that such a function exists.	quantity that expresses the extent of a two-dimensional surface or shape, or planar lamina, in the plane	wikipedia
Areas affected	affect	Affect Co	NA	wikipedia
Areas affected	areas	a particular environment or walk of life	sphere, domain, area, orbit, field, arena	wordnet
Areas affected	affected	act physically on; have an effect upon	affect	wordnet
Areas affected	area	Area is how many square units are inside the whole shape	NA	GenericsKB
Areas affected	affect	Affects cause feel	NA	GenericsKB
Total damage	total	Total is the first greatest hits album by Mexican pop rock singer Belinda	album by Belinda Peregrin	wikipedia
Total damage	damage	"Damage is any change in a thing, often a physical object, that degrades it away from its initial state. It can broadly be defined as ""changes introduced into a system that adversely affect its current or future performance"". Damage ""does not necessarily imply total loss of system functionality, but rather that the system is no longer operating in its optimal manner"". Damage to physical objects is ""the progressive physical process by which they break"", and includes mechanical stress that weakens a structure, even if this is not visible."	loss or harm caused by an action or event	wikipedia
Total damage	total	constituting the full quantity or extent; complete	entire, full, total	wordnet
Total damage	damage	loss of military equipment	damage, equipment_casualty	wordnet
Total damage	total	A total is an unit	NA	GenericsKB
Total damage	damage	Damage can develop very quickly and the mites can kill or seriously stunt the growth of plants	NA	GenericsKB
Max. intensity	max	Arriva MAX is a premium brand used by various Arriva bus subsidiaries in the United Kingdom	premium brand used by various Arriva bus subsidiaries in the United Kingdom	wikipedia
Max. intensity	intensity	An electric current is the rate of flow of electric charge past a point or region	flow of electric charge (for specific quantities see Q29996 or Q234072)	wikipedia
Max. intensity	max	street names for gamma hydroxybutyrate	soap, scoop, max, liquid_ecstasy, grievous_bodily_harm, goop, Georgia_home_boy, easy_lay	wordnet
Max. intensity	intensity	chromatic purity: freedom from dilution with white and hence vivid in hue	saturation, chroma, intensity, vividness	wordnet
Max. intensity	max	Maxs are magazines	NA	GenericsKB
Max. intensity	intensity	Intensities portray the effects of an earthquake in a particular location	NA	GenericsKB
Peak acceleration	peak	The British Rail Class 45 also known as the Sulzer Type 4 diesel locomotives were built by British Railways' Derby and Crewe Works between 1960 and 1962	class of 127 (1Co)(Co1) diesel electric locomotives	wikipedia
Peak acceleration	acceleration	In mechanics, acceleration is the rate of change of the velocity of an object with respect to time. Accelerations are vector quantities . The orientation of an object's acceleration is given by the orientation of the net force acting on that object. The magnitude of an object's acceleration, as described by Newton's Second Law, is the combined effect of two causes: * the net balance of all external forces acting onto that object — magnitude is directly proportional to this net resulting force; * that object's mass, depending on the materials out of which it is made — magnitude is inversely proportional to the object's mass. The SI unit for acceleration is metre per second squared . For example, when a vehicle starts from a standstill and travels in a straight line at increasing speeds, it is accelerating in the direction of travel. If the vehicle turns, an acceleration occurs toward the new direction and changes its motion vector. The acceleration of the vehicle in its current direction of motion is called a linear acceleration, the reaction to which the passengers onboard experience as a force pushing them back into their seats. When changing direction, the effecting acceleration is called radial acceleration, the reaction to which the passengers experience as a centrifugal force. If the speed of the vehicle decreases, this is an acceleration in the opposite direction and mathematically a negative, sometimes called deceleration , and passengers experience the reaction to deceleration as an inertial force pushing them forward. Such negative accelerations are often achieved by retrorocket burning in spacecrafts. Both acceleration and deceleration are treated the same, they are both changes in velocity. Each of these accelerations is felt by passengers until their relative velocity are neutralized in reference to the vehicle.	rate at which the magnitude and/or direction of velocity changes with time	wikipedia
Peak acceleration	peak	the highest point (of something)	vertex, peak, apex, acme	wordnet
Peak acceleration	acceleration	an increase in rate of change	acceleration	wordnet
Peak acceleration	peak	Peak flows downstream increase when jams break up and quickly release stored water	NA	GenericsKB
Peak acceleration	acceleration	Acceleration also increases the electron current flowing between the atmosphere and magnetosphere	NA	GenericsKB
Peak velocity	peak	The British Rail Class 45 also known as the Sulzer Type 4 diesel locomotives were built by British Railways' Derby and Crewe Works between 1960 and 1962	class of 127 (1Co)(Co1) diesel electric locomotives	wikipedia
Peak velocity	velocity	"The velocity of an object is the rate of change of its position with respect to a frame of reference, and is a function of time. Velocity is equivalent to a specification of an object's speed and direction of motion . Velocity is a fundamental concept in kinematics, the branch of classical mechanics that describes the motion of bodies. Velocity is a physical vector quantity; both magnitude and direction are needed to define it. The scalar absolute value of velocity is called speed , being a coherent derived unit whose quantity is measured in the SI as metres per second or as the SI base unit of . For example, ""5 metres per second"" is a scalar, whereas ""5 metres per second east"" is a vector. If there is a change in speed, direction or both, then the object has a changing velocity and is said to be undergoing an acceleration."	rate of change of the position of an object as a function of time, and the direction of that change	wikipedia
Peak velocity	peak	the highest point (of something)	vertex, peak, apex, acme	wordnet
Peak velocity	velocity	distance travelled per unit time	speed, velocity	wordnet
Peak velocity	peak	Peak flows downstream increase when jams break up and quickly release stored water	NA	GenericsKB
Peak velocity	velocity	Velocities are relative to the Pacific plate	NA	GenericsKB
Tsunami	tsunami	"A tsunami soo- NAH-mee, suu- pronounced ) is a series of waves in a water body caused by the displacement of a large volume of water, generally in an ocean or a large lake. Earthquakes, volcanic eruptions and other underwater explosions above or below water all have the potential to generate a tsunami. Unlike normal ocean waves, which are generated by wind, or tides, which are generated by the gravitational pull of the Moon and the Sun, a tsunami is generated by the displacement of water. Tsunami waves do not resemble normal undersea currents or sea waves because their wavelength is far longer. Rather than appearing as a breaking wave, a tsunami may instead initially resemble a rapidly rising tide. For this reason, it is often referred to as a tidal wave , although this usage is not favoured by the scientific community because it might give the false impression of a causal relationship between tides and tsunamis. Tsunamis generally consist of a series of waves, with periods ranging from minutes to hours, arriving in a so-called ""wave train"". Wave heights of tens of metres can be generated by large events. Although the impact of tsunamis is limited to coastal areas, their destructive power can be enormous, and they can affect entire ocean basins. The 2004 Indian Ocean tsunami was among the deadliest natural disasters in human history, with at least 230,000 people killed or missing in 14 countries bordering the Indian Ocean. The Ancient Greek historian Thucydides suggested in his 5th century BC History of the Peloponnesian War that tsunamis were related to submarine earthquakes, but the understanding of tsunamis remained slim until the 20th century and much remains unknown. Major areas of current research include determining why some large earthquakes do not generate tsunamis while other smaller ones do; accurately forecasting the passage of tsunamis across the oceans; and forecasting how tsunami waves interact with shorelines."	series of water waves caused by the displacement of a large volume of a body of water	wikipedia
Tsunami	tsunami	a cataclysm resulting from a destructive sea wave caused by an earthquake or volcanic eruption	tsunami	wordnet
Tsunami	tsunami	a long, high sea wave caused by an earthquake or other disturbance.	NA	owlbot
Tsunami	tsunami	Tsunami is a wave	NA	GenericsKB
Landslides	landslides	The term landslide or less frequently, landslip , refers to several forms of mass wasting that include a wide range of ground movements, such as rockfalls, deep-seated slope failures, mudflows, and debris flows. Landslides occur in a variety of environments, characterized by either steep or gentle slope gradients, from mountain ranges to coastal cliffs or even underwater, in which case they are called submarine landslides. Gravity is the primary driving force for a landslide to occur, but there are other factors affecting slope stability that produce specific conditions that make a slope prone to failure. In many cases, the landslide is triggered by a specific event , although this is not always identifiable.	type of natural disasters involving ground movements, often caused by slope instability triggered by specific event	wikipedia
Landslides	landslides	a slide of a large mass of dirt and rock down a mountain or cliff	landslide, landslip	wordnet
Landslides	landslides	a collapse of a mass of earth or rock from a mountain or cliff.	NA	owlbot
Foreshocks	foreshocks	A foreshock is an earthquake that occurs before a larger seismic event and is related to it in both time and space. The designation of an earthquake as foreshock , mainshock or aftershock is only possible after the full sequence of events has happened.	Earthquake that occurs before the larger mainshock, and is related to the latter in both time and space	wikipedia
Foreshocks	foreshocks	a tremor preceding an earthquake	foreshock	wordnet
Foreshocks	foreshock	Foreshocks are earthquakes that occur before the main earthquake	NA	GenericsKB
Aftershocks	aftershocks	An aftershock is a smaller earthquake that follows a larger earthquake, in the same area of the main shock, caused as the displaced crust adjusts to the effects of the main shock. Large earthquakes can have hundreds to thousands of instrumentally detectable aftershocks, which steadily decrease in magnitude and frequency according to known laws. In some earthquakes the main rupture happens in two or more steps, resulting in multiple main shocks. These are known as doublet earthquakes, and in general can be distinguished from aftershocks in having similar magnitudes and nearly identical seismic waveforms.	smaller earthquake that occurs after a previous large earthquake	wikipedia
Aftershocks	aftershocks	a tremor (or one of a series of tremors) occurring after the main shock of an earthquake	aftershock	wordnet
Aftershocks	aftershock	Aftershocks are earthquakes themselves and can be as severe as the original temblor	NA	GenericsKB
Casualties	casualties	"A casualty , as a term in military usage, is a person in military service, combatant or non-combatant, who becomes unavailable for duty due to several circumstances, including death, injury, illness, capture or desertion. In civilian usage, a casualty is a person who is killed, wounded or incapacitated by some event; the term is usually used to describe multiple deaths and injuries due to violent incidents or disasters. It is sometimes misunderstood to mean ""fatalities"", but non-fatal injuries are also casualties."	member of military personnel that becomes unavailable for duty	wikipedia
Casualties	casualties	a decrease of military personnel or equipment	casualty	wordnet
