key	keyword	definition	description	source
Developer	developer	A computer programmer , sometimes called a software developer , a programmer or more recently a coder , is a person who creates computer software	person who writes computer software	wikipedia
Developer	developer	photographic equipment consisting of a chemical solution for developing film	developer	wordnet
Developer	developer	a person or thing that develops something.	NA	owlbot
Developer	developer	Developer creates databases	NA	GenericsKB
OS family	os	Austrian Airlines AG , sometimes shortened to Austrian , is the flag carrier of Austria and a subsidiary of the Lufthansa Group	Austrian flag carrier airline	wikipedia
OS family	family	"In human society, family is a group of people related either by consanguinity or affinity . The purpose of families is to maintain the well-being of its members and of society. Ideally, families would offer predictability, structure, and safety as members mature and participate in the community. In most societies, it is within families that children acquire socialization for life outside the family. Additionally, as the basic unit for meeting the basic needs of its members, it provides a sense of boundaries for performing tasks in a safe environment, ideally builds a person into a functional adult, transmits culture, and ensures continuity of humankind with precedents of knowledge. Anthropologists generally classify most family organizations as matrifocal ; patrifocal ; conjugal ; avuncular ; or extended . Members of the immediate family may include spouses, parents, grandparents, brothers, sisters, sons, and daughters. Members of the extended family may include aunts, uncles, cousins, nephews, nieces, and siblings-in-law. Sometimes these are also considered members of the immediate family, depending on an individual's specific relationship with them, and the legal definition of ""immediate family"" varies. Sexual relations with family members are regulated by rules concerning incest such as the incest taboo. The field of genealogy aims to trace family lineages through history. The family is also an important economic unit studied in family economics. The word ""families"" can be used metaphorically to create more inclusive categories such as community, nationhood, global village, and humanism."	group of people affiliated by consanguinity, affinity, or co-residence	wikipedia
OS family	os	(computer science) software that controls the execution of computer programs and may provide various services	operating_system, OS	wordnet
OS family	family	a collection of things sharing a common attribute	class, category, family	wordnet
OS family	os	Oses are software	NA	GenericsKB
OS family	family	A family is an unit	NA	GenericsKB
Working state	work	Employment is a relationship between two parties, usually based on a contract where work is paid for, where one party, which may be a corporation, for profit, not-for-profit organization, co-operative or other entity is the employer and the other is the employee	relationship between the employee and the employer	wikipedia
Working state	working	have an effect or outcome; often the one desired or expected	work, act	wordnet
Working state	state	the way something is with respect to its main attributes	state	wordnet
Working state	work	Work affects family because the same people who play work roles also play family roles	NA	GenericsKB
Working state	state	State is a tuple containing the state of the coder	NA	GenericsKB
Source model	source model	The open-source model is a decentralized software development model that encourages open collaboration. A main principle of open-source software development is peer production, with products such as source code, blueprints, and documentation freely available to the public. The open-source movement in software began as a response to the limitations of proprietary code. The model is used for projects such as in open-source appropriate technology, and open- source drug discovery. Open source promotes universal access via an open-source or free license to a product's design or blueprint, and universal redistribution of that design or blueprint. Before the phrase open source became widely adopted, developers and producers used a variety of other terms. Open source gained hold with the rise of the Internet. The open-source software movement arose to clarify copyright, licensing, domain, and consumer issues. Generally, open source refers to a computer program in which the source code is available to the general public for use or modification from its original design. Open-source code is meant to be a collaborative effort, where programmers improve upon the source code and share the changes within the community. Code is released under the terms of a software license. Depending on the license terms, others may then download, modify, and publish their version back to the community. Many large formal institutions have sprung up to support the development of the open-source movement, including the Apache Software Foundation, which supports community projects such as the open-source framework Apache Hadoop and the open-source HTTP server Apache HTTP.	philosophy about free redistribution and access to a product	wikipedia
Source model	source	a facility where something is available	source	wordnet
Source model	model	a hypothetical description of a complex entity or process	model, theoretical_account, framework	wordnet
Source model	source	Source hashing is similar to hashing in a database	NA	GenericsKB
Source model	model	Models are abstracts	NA	GenericsKB
Initial release	initial	"In a written or published work, an initial or drop cap is a letter at the beginning of a word, a chapter, or a paragraph that is larger than the rest of the text. The word is derived from the Latin initialis , which means standing at the beginning. An initial is often several lines in height and in older books or manuscripts, sometimes ornately decorated. In illuminated manuscripts, initials with images inside them, such as those illustrated here, are known as historiated initials. They were an invention of the Insular art of the British Isles in the eighth century. Initials containing, typically, plant-form spirals with small figures of animals or humans that do not represent a specific person or scene are known as ""inhabited"" initials. Certain important initials, such as the Beatus initial or ""B"" of Beatus vir... at the opening of Psalm 1 at the start of a vulgate Latin psalter, could occupy a whole page of a manuscript. These specific initials, in an illuminated manuscript, also were called initiums."	letter at the beginning of a word, a chapter, or a paragraph that is larger than the rest of the text	wikipedia
Initial release	release	The ICD-10 Procedure Coding System is an international system of medical classification used for procedural coding	International Classification of Diseases 10th Revision (ICD-10) procedure classification system, published by the US for classifying procedures	wikipedia
Initial release	initial	occurring at the beginning	initial	wordnet
Initial release	release	the termination of someone's employment (leaving them free to depart)	dismissal, dismission, discharge, firing, liberation, release, sack, sacking	wordnet
Initial release	initial	Initials are the most usual form of abbreviation	NA	GenericsKB
Initial release	release	Releases are devices	NA	GenericsKB
Latest release	late release	In the computer industry, vaporware is a product, typically computer hardware or software, that is announced to the general public but is never actually manufactured nor officially cancelled	product that is announced but is never actually released nor officially cancelled	wikipedia
Latest release	latest	of the immediate past or just previous to the present time	late, recent	wordnet
Latest release	release	the termination of someone's employment (leaving them free to depart)	dismissal, dismission, discharge, firing, liberation, release, sack, sacking	wordnet
Latest release	release	Releases are devices	NA	GenericsKB
Latest preview	late	Late Island is an uninhabited volcanic island southwest of Vavaʻu in the kingdom of Tonga	island of Tonga	wikipedia
Latest preview	preview	DJ Drama Presents: The Preview is a mixtape by Ludacris and DJ Drama as promotion for Ludacris' album Theater of the Mind and his film releases in the fall of 2008	album by Ludacris	wikipedia
Latest preview	latest	of the immediate past or just previous to the present time	late, recent	wordnet
Latest preview	preview	an advertisement consisting of short scenes from a motion picture that will appear in the near future	preview, prevue, trailer	wordnet
Latest preview	preview	Previews are ads	NA	GenericsKB
Available in	available	In reliability engineering, the term availability has the following meanings: * The degree to which a system, subsystem or equipment is in a specified operable and committable state at the start of a mission, when the mission is called for at an unknown, i.e. a random, time. * The probability that an item will operate satisfactorily at a given point in time when used under stated conditions in an ideal support environment. Normally high availability systems might be specified as 99.98%, 99.999% or 99.9996%.	term in information security	wikipedia
Available in	available	not busy; not otherwise committed	available, uncommitted	wordnet
Available in	available	able to be used or obtained; at someone's disposal.	NA	owlbot
Available in	available	Avails are bands	NA	GenericsKB
Update method	update	An SQL UPDATE statement changes the data of one or more records in a table	SQL statement	wikipedia
Update method	method	A method in object-oriented programming is a procedure associated with a message and an object	computer function or subroutine that is tied to a particular instance or class	wikipedia
Update method	update	bring up to date; supply with recent information	update	wordnet
Update method	method	a way of doing something, especially a systematic way; implies an orderly logical arrangement (usually in steps)	method	wordnet
Update method	update	Updates are activities	NA	GenericsKB
Update method	method	Methods allow comparison	NA	GenericsKB
Package manager	package manager	A package manager or package-management system is a collection of software tools that automates the process of installing, upgrading, configuring, and removing computer programs for a computer's operating system in a consistent manner. A package manager deals with packages , distributions of software and data in archive files. Packages contain metadata, such as the software's name, description of its purpose, version number, vendor, checksum , and a list of dependencies necessary for the software to run properly. Upon installation, metadata is stored in a local package database. Package managers typically maintain a database of software dependencies and version information to prevent software mismatches and missing prerequisites. They work closely with software repositories, binary repository managers, and app stores. Package managers are designed to eliminate the need for manual installs and updates. This can be particularly useful for large enterprises whose operating systems are typically consisting of hundreds or even tens of thousands of distinct software packages.	software tools for handling software packages	wikipedia
Package manager	package	put into a box	box, package	wordnet
Package manager	manager	someone who controls resources and expenditures	director, manager, managing_director	wordnet
Package manager	package	Package is a aggregation	NA	GenericsKB
Package manager	manager	Manager is a administrator	NA	GenericsKB
Platforms	platforms	A car platform is a shared set of common design, engineering, and production efforts, as well as major components over a number of outwardly distinct models and even types of cars, often from different, but somewhat related marques	similar design and engineering specs shared between multiple cars.	wikipedia
Platforms	platforms	the combination of a particular computer and a particular operating system	platform	wordnet
Platforms	platforms	the declared policy of a political party or group.	NA	owlbot
Platforms	platform	Platforms are computer operating systems	NA	GenericsKB
Kernel type	kernel	In computing, a compute kernel is a routine compiled for high throughput accelerators , digital signal processors or field-programmable gate arrays ), separate from but used by a main program 	computing routine compiled for an accelerator	wikipedia
Kernel type	type	Arity ) is the number of arguments or operands that a function or operation in logic, mathematics, and computer science takes	fixed number of arguments or operands that a function or operation requires	wikipedia
Kernel type	kernel	the choicest or most essential or most vital part of some idea or experience	kernel, substance, core, center, centre, essence, gist, heart, heart_and_soul, inwardness, marrow, meat, nub, pith, sum, nitty-gritty	wordnet
Kernel type	type	(biology) the taxonomic group whose characteristics are used to define the next higher taxon	type	wordnet
Kernel type	kernel	Kernels are content	NA	GenericsKB
Kernel type	type	Type checking asks whether a term can be given a particular type	NA	GenericsKB
Userland	userland	A modern computer operating system usually segregates virtual memory into kernel space and user space	software run under a kernel	wikipedia
Userland	userland			wordnet
Default user interface	default	""" Default "" is a song by British rock band Django Django"	song by Django Django	wikipedia
Default user interface	user	Freeloading and mooching are colloquial terms for when a person uses resources that do not belong to them, for their own gain or benefit	Wikimedia disambiguation page	wikipedia
Default user interface	interface	A business interoperability interface is an interface that enables business interoperability between organizational systems	NA	wikipedia
Default user interface	default	an option that is selected automatically unless an alternative is specified	default_option, default	wordnet
Default user interface	user	a person who takes drugs	drug_user, substance_abuser, user	wordnet
Default user interface	interface	(computer science) a program that controls a display for the user (usually on a computer monitor) and that allows the user to interact with the system	interface, user_interface	wordnet
Default user interface	default	Defaults are failure	NA	GenericsKB
Default user interface	user	Users access applications	NA	GenericsKB
Default user interface	interface	Interfaces are application programs	NA	GenericsKB
License	license	"A license or licence is an official permission or permit to do, use, or own something . A license can be granted by a party to another party as an element of an agreement between those parties. A shorthand definition of a license is ""an authorization to use licensed material."" In particular, a license may be issued by authorities, to allow an activity that would otherwise be forbidden. It may require paying a fee or proving a capability. The requirement may also serve to keep the authorities informed on a type of activity, and to give them the opportunity to set conditions and limitations. A licensor may grant a license under intellectual property laws to authorize a use to a licensee, sparing the licensee from a claim of infringement brought by the licensor. A license under intellectual property commonly has several components beyond the grant itself, including a term , territory , renewal provisions, and other limitations deemed vital to the licensor. Term: many licenses are valid for a particular length of time. This protects the licensor should the value of the license increase, or market conditions change. It also preserves enforceability by ensuring that no license extends beyond the term of the agreement. Territory: a license may stipulate what territory the rights pertain to. For example, a license with a territory limited to ""North America"" would not permit a licensee any protection from actions for use in Japan. A shorthand definition of license is ""a promise by the licensor not to sue the licensee"". That means without a license any use or exploitation of intellectual property by a third party would amount to copying or infringement. Such copying would be improper and could, by using the legal system, be stopped if the intellectual property owner wanted to do so. Intellectual property licensing plays a major role in business, academia and broadcasting. Business practices such as franchising, technology transfer, publication and character merchandising entirely depend on the licensing of intellectual property. Land licensing and IP licensing form sub-branches of law born out of the interplay of general laws of contract and specific principles and statutory laws relating to these respective assets."	set of permissions to use something	wikipedia
License	license	a legal document giving official permission to do something	license, licence, permit	wordnet
License	license	freedom to behave as one wishes, especially in a way which results in excessive or unacceptable behaviour.	NA	owlbot
License	license	License is credentials	NA	GenericsKB
Official website	official website	A website is a collection of web pages and related content that is identified by a common domain name and published on at least one web server. Notable examples are wikipedia.org, google.com, and amazon.com. All publicly accessible websites collectively constitute the World Wide Web. There are also private websites that can only be accessed on a private network, such as a company's internal website for its employees. Websites are typically dedicated to a particular topic or purpose, such as news, education, commerce, entertainment, or social networking. Hyperlinking between web pages guides the navigation of the site, which often starts with a home page. Users can access websites on a range of devices, including desktops, laptops, tablets, and smartphones. The software application used on these devices is called a web browser.	set of related web pages served from a single web domain	wikipedia
Official website	official	a worker who holds or is invested with an office	official, functionary	wordnet
Official website	website	a computer connected to the internet that maintains a series of web pages on the World Wide Web	web_site, website, internet_site, site	wordnet
Official website	official	Official is a worker	NA	GenericsKB
Official website	website	A website is a computer	NA	GenericsKB
