key	keyword	definition	description	source
Type	type	Categorization is an activity that consists of putting things into categories based on their similarities or common criteria	cognitive process in which ideas and objects are recognized, differentiated, and understood	wikipedia
Type	type	(biology) the taxonomic group whose characteristics are used to define the next higher taxon	type	wordnet
Type	type	a person or thing exemplifying the ideal or defining characteristics of something.	NA	owlbot
Type	type	A type is a kind	NA	GenericsKB
Region	region	In geography, regions are areas that are broadly divided by physical characteristics , human impact characteristics , and the interaction of humanity and the environment . Geographic regions and sub-regions are mostly described by their imprecisely defined, and sometimes transitory boundaries, except in human geography, where jurisdiction areas such as national borders are defined in law. Apart from the global continental regions, there are also hydrospheric and atmospheric regions that cover the oceans, and discrete climates above the land and water masses of the planet. The land and water global regions are divided into subregions geographically bounded by large geological features that influence large-scale ecologies, such as plains and features. As a way of describing spatial areas, the concept of regions is important and widely used among the many branches of geography, each of which can describe areas in regional terms. For example, ecoregion is a term used in environmental geography, cultural region in cultural geography, bioregion in biogeography, and so on. The field of geography that studies regions themselves is called regional geography. In the fields of physical geography, ecology, biogeography, zoogeography, and environmental geography, regions tend to be based on natural features such as ecosystems or biotopes, biomes, drainage basins, natural regions, mountain ranges, soil types. Where human geography is concerned, the regions and subregions are described by the discipline of ethnography. A region has its own nature that could not be moved. The first nature is its natural environment . The second nature is its physical elements complex that were built by people in the past. The third nature is its socio-cultural context that could not be replaced by new immigrants.	2D or 3D defined space, mainly in terrestrial and astrophysics sciences	wikipedia
Region	region	a knowledge domain that you are interested in or are communicating about	region, realm	wordnet
Region	region	a part of the body, especially around or near an organ.	NA	owlbot
Region	region	A region is a location	NA	GenericsKB
Etymology	etymology	"Etymology is the study of the history of words. By extension, the phrase ""the etymology of "" means the origin of the particular word. For place names, there is a specific term, toponymy. For languages with a long written history, etymologists make use of texts, and texts about the language, to gather knowledge about how words were used during earlier periods, how they developed in meaning and form, or when and how they entered the language. Etymologists also apply the methods of comparative linguistics to reconstruct information about forms that are too old for any direct information to be available. By analyzing related languages with a technique known as the comparative method, linguists can make inferences about their shared parent language and its vocabulary. In this way, word roots in European languages, for example, can be traced all the way back to the origin of the Indo-European language family. Even though etymological research originally grew from the philological tradition, much current etymological research is done on language families where little or no early documentation is available, such as Uralic and Austronesian. The word etymology derives from the Greek word ἐτυμολογία , itself from ἔτυμον , meaning ""true sense or sense of a truth"", and the suffix -logia , denoting ""the study of"". The term etymon refers to a word or morpheme from which a later word or morpheme derives. For example, the Latin word candidus , which means ""white"", is the etymon of English candid. Relationships are often less transparent, however. English place names such as Winchester, Gloucester, Tadcaster share in different modern forms a suffixed etymon that was once meaningful, Latin castrum 'fort'."	study of the history of words, their origins, and how their form and meaning have changed over time	wikipedia
Etymology	etymology	a history of a word	etymology	wordnet
Etymology	etymology	the study of the origin of words and the way in which their meanings have changed throughout history.	NA	owlbot
Etymology	etymology	Etymology is straightforward speech	NA	GenericsKB
Seat	seat	A seat is a place to sit. The term may encompass additional features, such as back, armrest, head restraint but also headquarters in a wider sense.	object for sitting on	wikipedia
Seat	seat	a center of authority (as a city from which authority is exercised)	seat	wordnet
Seat	seat	a principal site or location.	NA	owlbot
Seat	seat	Seat is a location	NA	GenericsKB
Coordinates	coordinates	"In geometry, a coordinate system is a system that uses one or more numbers, or coordinates , to uniquely determine the position of the points or other geometric elements on a manifold such as Euclidean space. The order of the coordinates is significant, and they are sometimes identified by their position in an ordered tuple and sometimes by a letter, as in ""the x -coordinate"". The coordinates are taken to be real numbers in elementary mathematics, but may be complex numbers or elements of a more abstract system such as a commutative ring. The use of a coordinate system allows problems in geometry to be translated into problems about numbers and vice versa ; this is the basis of analytic geometry."	System for determining the position of a point by a tuple of scalars	wikipedia
Coordinates	coordinates	a number that identifies a position relative to an axis	coordinate, co-ordinate	wordnet
Coordinates	coordinates	bring the different elements of (a complex activity or organization) into a harmonious or efficient relationship.	NA	owlbot
Districts	districts	"A district is a type of administrative division that, in some countries, is managed by local government. Across the world, areas known as ""districts"" vary greatly in size, spanning regions or counties, several municipalities, subdivisions of municipalities, school district, or political district."	type of administrative division, in some countries	wikipedia
Districts	districts	regulate housing in; of certain areas of towns	zone, district	wordnet
Districts	districts	an area of a country or city, especially one characterized by a particular feature or activity.	NA	owlbot
Districts	district	A district is a region	NA	GenericsKB
Mayor	mayor	In many countries, a mayor is the highest-ranking official in a municipal government such as that of a city or a town. Worldwide, there is a wide variance in local laws and customs regarding the powers and responsibilities of a mayor as well as the means by which a mayor is elected or otherwise mandated. Depending on the system chosen, a mayor may be the chief executive officer of the municipal government, may simply chair a multi-member governing body with little or no independent power, or may play a solely ceremonial role. Options for selection of a mayor include direct election by the public, or selection by an elected governing council or board.	head of municipal government such as a town or city	wikipedia
Mayor	mayor	the head of a city government	mayor, city_manager	wordnet
Mayor	mayor	(in England, Wales, and Northern Ireland) the head of a town, borough, or county council, elected by council members and generally having purely ceremonial duties.	NA	owlbot
Mayor	mayor	A mayor is civil authority	NA	GenericsKB
Special municipality Population	special	Discounts and allowances are reductions to a basic price of goods or services	reductions in the basic prices of goods or services	wikipedia
Special municipality Population	municipality	A municipality is usually a single administrative division having corporate status and powers of self-government or jurisdiction as granted by national and regional laws to which it is subordinate. It is to be distinguished from the county, which may encompass rural territory or numerous small communities such as towns, villages and hamlets. The term municipality may also mean the governing or ruling body of a given municipality. A municipality is a general-purpose administrative subdivision, as opposed to a special-purpose district. The term is derived from French municipalité and Latin municipalis. The English word municipality derives from the Latin social contract municipium , referring to the Latin communities that supplied Rome with troops in exchange for their own incorporation into the Roman state while permitting the communities to retain their own local governments . A municipality can be any political jurisdiction from a sovereign state, such as the Principality of Monaco, to a small village, such as West Hampton Dunes, New York. The territory over which a municipality has jurisdiction may encompass * only one populated place such as a city, town, or village * several of such places as townships governing several villages, Municipalities of Mexico, Municipalities of Colombia) * only parts of such places, sometimes boroughs of a city such as the 34 municipalities of Santiago, Chile.	urban administrative division having corporate status and usually powers of self-government or jurisdiction	wikipedia
Special municipality Population	population	In biology, a population is all the organisms of the same group or species who live in a particular geographical area and are capable of interbreeding. The area of a sexual population is the area where inter-breeding is possible between any pair within the area and more probable than cross-breeding with individuals from other areas. In sociology, population refers to a collection of humans. Demography is a social science which entails the statistical study of populations. Population, in simpler terms, is the number of people in a city or town, region, country or world; population is usually determined by a process called census .	ensemble of individuals of a species in an area, or their number	wikipedia
Special municipality Population	special	a dish or meal given prominence in e.g. a restaurant	special	wordnet
Special municipality Population	municipality	an urban district having corporate status and powers of self-government	municipality	wordnet
Special municipality Population	population	the number of inhabitants (either the total number or the number of a particular race or class) in a given place (country or city etc.)	population	wordnet
Special municipality Population	special	A special is an offer	NA	GenericsKB
Special municipality Population	municipality	Municipalities also are general purpose governments	NA	GenericsKB
Special municipality Population	population	Population aging affects economic decisions and public policies	NA	GenericsKB
Urban Population	urban population	"An urban area , or built-up area , is a human settlement with a high population density and infrastructure of built environment. Urban areas are created through urbanization and are categorized by urban morphology as cities, towns, conurbations or suburbs. In urbanism, the term contrasts to rural areas such as villages and hamlets; in urban sociology or urban anthropology it contrasts with natural environment. The creation of early predecessors of urban areas during the urban revolution led to the creation of human civilization with modern urban planning, which along with other human activities such as exploitation of natural resources led to a human impact on the environment. ""Agglomeration effects"" are in the list of the main consequences of increased rates of firm creation since. This is due to conditions created by a greater level of industrial activity in a given region. However, a favorable environment for human capital development would also be generated simultaneously. The world's urban population in 1950 of just 746 million has increased to 3.9 billion in the decades since. In 2009, the number of people living in urban areas surpassed the number living in rural areas , and since then the world has become more urban than rural. This was the first time that the majority of the world's population lived in a city. In 2014 there were 7.2 billion people living on the planet, of which the global urban population comprised 3.9 billion. The Population Division of the United Nations Department of Economic and Social Affairs at that time predicted the urban population would grow to 6.4 billion by 2050, with 37% of that growth to come from three countries: China, India and Nigeria. > The UN publishes data on cities, urban areas and rural areas, but relies > almost entirely on national definitions of these areas. The UN principles > and recommendations state that due to different characteristics of urban and > rural areas across the globe, a global definition is not possible. Urban areas are created and further developed by the process of urbanization. Urban areas are measured for various purposes, including analyzing population density and urban sprawl. Unlike an urban area, a metropolitan area includes not only the urban area, but also satellite cities plus intervening rural land that is socio- economically connected to the urban core city, typically by employment ties through commuting, with the urban core city being the primary labor market. The concept of an ""urban area"" as used in economic statistics should not be confused with the concept of the ""urban area"" used in road safety statistics. The last concept is also known as ""built-up area in road safety"". According to the definition by the Office for National Statistics, ""Built-up areas are defined as land which is 'irreversibly urban in character', meaning that they are characteristic of a town or city. They include areas of built-up land with a minimum of 20 hectares . Any areas less than 200 metres are linked to become a single built-up area."	"human settlement with high population density and infrastructure of built environment (Use Q2983893 ""urban district"" for a neighbourhood within a larger urban area; use Q1907114 ""metropolitan area"" for a wider area)"	wikipedia
Urban Population	urban	located in or characteristic of a city or city life	urban	wordnet
Urban Population	population	the number of inhabitants (either the total number or the number of a particular race or class) in a given place (country or city etc.)	population	wordnet
Urban Population	urban population	Urban population is the midyear population of areas defined as urban in each country	NA	GenericsKB
Special municipality Area	special	Discounts and allowances are reductions to a basic price of goods or services	reductions in the basic prices of goods or services	wikipedia
Special municipality Area	municipality	A municipality is usually a single administrative division having corporate status and powers of self-government or jurisdiction as granted by national and regional laws to which it is subordinate. It is to be distinguished from the county, which may encompass rural territory or numerous small communities such as towns, villages and hamlets. The term municipality may also mean the governing or ruling body of a given municipality. A municipality is a general-purpose administrative subdivision, as opposed to a special-purpose district. The term is derived from French municipalité and Latin municipalis. The English word municipality derives from the Latin social contract municipium , referring to the Latin communities that supplied Rome with troops in exchange for their own incorporation into the Roman state while permitting the communities to retain their own local governments . A municipality can be any political jurisdiction from a sovereign state, such as the Principality of Monaco, to a small village, such as West Hampton Dunes, New York. The territory over which a municipality has jurisdiction may encompass * only one populated place such as a city, town, or village * several of such places as townships governing several villages, Municipalities of Mexico, Municipalities of Colombia) * only parts of such places, sometimes boroughs of a city such as the 34 municipalities of Santiago, Chile.	urban administrative division having corporate status and usually powers of self-government or jurisdiction	wikipedia
Special municipality Area	area	Area is the quantity that expresses the extent of a two-dimensional figure or shape or planar lamina, in the plane. Surface area is its analog on the two-dimensional surface of a three-dimensional object. Area can be understood as the amount of material with a given thickness that would be necessary to fashion a model of the shape, or the amount of paint necessary to cover the surface with a single coat. It is the two-dimensional analog of the length of a curve or the volume of a solid . The area of a shape can be measured by comparing the shape to squares of a fixed size. In the International System of Units , the standard unit of area is the square metre , which is the area of a square whose sides are one metre long. A shape with an area of three square metres would have the same area as three such squares. In mathematics, the unit square is defined to have area one, and the area of any other shape or surface is a dimensionless real number. There are several well-known formulas for the areas of simple shapes such as triangles, rectangles, and circles. Using these formulas, the area of any polygon can be found by dividing the polygon into triangles. For shapes with curved boundary, calculus is usually required to compute the area. Indeed, the problem of determining the area of plane figures was a major motivation for the historical development of calculus. For a solid shape such as a sphere, cone, or cylinder, the area of its boundary surface is called the surface area. Formulas for the surface areas of simple shapes were computed by the ancient Greeks, but computing the surface area of a more complicated shape usually requires multivariable calculus. Area plays an important role in modern mathematics. In addition to its obvious importance in geometry and calculus, area is related to the definition of determinants in linear algebra, and is a basic property of surfaces in differential geometry. In analysis, the area of a subset of the plane is defined using Lebesgue measure, though not every subset is measurable. In general, area in higher mathematics is seen as a special case of volume for two-dimensional regions. Area can be defined through the use of axioms, defining it as a function of a collection of certain plane figures to the set of real numbers. It can be proved that such a function exists.	quantity that expresses the extent of a two-dimensional surface or shape, or planar lamina, in the plane	wikipedia
Special municipality Area	special	a dish or meal given prominence in e.g. a restaurant	special	wordnet
Special municipality Area	municipality	an urban district having corporate status and powers of self-government	municipality	wordnet
Special municipality Area	area	the extent of a 2-dimensional surface enclosed within a boundary	area, expanse, surface_area	wordnet
Special municipality Area	special	Specials are bands	NA	GenericsKB
Special municipality Area	municipality	Municipalities also are general purpose governments	NA	GenericsKB
Special municipality Area	area	Area is how many square units are inside the whole shape	NA	GenericsKB
Urban Area	urban area	"An urban area , or built-up area , is a human settlement with a high population density and infrastructure of built environment. Urban areas are created through urbanization and are categorized by urban morphology as cities, towns, conurbations or suburbs. In urbanism, the term contrasts to rural areas such as villages and hamlets; in urban sociology or urban anthropology it contrasts with natural environment. The creation of early predecessors of urban areas during the urban revolution led to the creation of human civilization with modern urban planning, which along with other human activities such as exploitation of natural resources led to a human impact on the environment. ""Agglomeration effects"" are in the list of the main consequences of increased rates of firm creation since. This is due to conditions created by a greater level of industrial activity in a given region. However, a favorable environment for human capital development would also be generated simultaneously. The world's urban population in 1950 of just 746 million has increased to 3.9 billion in the decades since. In 2009, the number of people living in urban areas surpassed the number living in rural areas , and since then the world has become more urban than rural. This was the first time that the majority of the world's population lived in a city. In 2014 there were 7.2 billion people living on the planet, of which the global urban population comprised 3.9 billion. The Population Division of the United Nations Department of Economic and Social Affairs at that time predicted the urban population would grow to 6.4 billion by 2050, with 37% of that growth to come from three countries: China, India and Nigeria. > The UN publishes data on cities, urban areas and rural areas, but relies > almost entirely on national definitions of these areas. The UN principles > and recommendations state that due to different characteristics of urban and > rural areas across the globe, a global definition is not possible. Urban areas are created and further developed by the process of urbanization. Urban areas are measured for various purposes, including analyzing population density and urban sprawl. Unlike an urban area, a metropolitan area includes not only the urban area, but also satellite cities plus intervening rural land that is socio- economically connected to the urban core city, typically by employment ties through commuting, with the urban core city being the primary labor market. The concept of an ""urban area"" as used in economic statistics should not be confused with the concept of the ""urban area"" used in road safety statistics. The last concept is also known as ""built-up area in road safety"". According to the definition by the Office for National Statistics, ""Built-up areas are defined as land which is 'irreversibly urban in character', meaning that they are characteristic of a town or city. They include areas of built-up land with a minimum of 20 hectares . Any areas less than 200 metres are linked to become a single built-up area."	"human settlement with high population density and infrastructure of built environment (Use Q2983893 ""urban district"" for a neighbourhood within a larger urban area; use Q1907114 ""metropolitan area"" for a wider area)"	wikipedia
Urban Area	urban	located in or characteristic of a city or city life	urban	wordnet
Urban Area	area	the extent of a 2-dimensional surface enclosed within a boundary	area, expanse, surface_area	wordnet
Urban Area	urban area	Urban areas are concentrations of population, property investment, and infrastructure	NA	GenericsKB
