key	keyword	definition	description	source
Motto(s)	motto	A motto is the general motivation or intention of an individual, family, social group or organization. Mottos are usually found predominantly in written form , and may stem from long traditions of social foundations, or from significant events, such as a civil war or a revolution. A motto may be in any language, but Latin has been widely used, especially in the Western world.	short sentence expressing a motivation	wikipedia
Motto(s)	motto	a favorite saying of a sect or political group	motto, slogan, catchword, shibboleth	wordnet
Motto(s)	motto	a short sentence or phrase chosen as encapsulating the beliefs or ideals of an individual, family, or institution.	NA	owlbot
Motto(s)	motto	A motto is expression	NA	GenericsKB
Coordinates	coordinates	"In geometry, a coordinate system is a system that uses one or more numbers, or coordinates , to uniquely determine the position of the points or other geometric elements on a manifold such as Euclidean space. The order of the coordinates is significant, and they are sometimes identified by their position in an ordered tuple and sometimes by a letter, as in ""the x -coordinate"". The coordinates are taken to be real numbers in elementary mathematics, but may be complex numbers or elements of a more abstract system such as a commutative ring. The use of a coordinate system allows problems in geometry to be translated into problems about numbers and vice versa ; this is the basis of analytic geometry."	System for determining the position of a point by a tuple of scalars	wikipedia
Coordinates	coordinates	a number that identifies a position relative to an axis	coordinate, co-ordinate	wordnet
Coordinates	coordinates	bring the different elements of (a complex activity or organization) into a harmonious or efficient relationship.	NA	owlbot
Province	province	"A province is almost always an administrative division within a country or state. The term derives from the ancient Roman provincia , which was the major territorial and administrative unit of the Roman Empire's territorial possessions outside Italy. The term province has since been adopted by many countries. In some countries with no actual provinces, ""the provinces"" is a metaphorical term meaning ""outside the capital city"". While some provinces were produced artificially by colonial powers, others were formed around local groups with their own ethnic identities. Many have their own powers independent of central or federal authority, especially in Canada. In other countries, like China or France, provinces are the creation of central government, with very little autonomy."	first-level administrative division in several countries	wikipedia
Province	province	the territory occupied by one of the constituent administrative districts of a nation	state, province	wordnet
Province	province	an area of special knowledge, interest, or responsibility.	NA	owlbot
Province	province	Province is a district	NA	GenericsKB
County	county	"A county is a geographical region of a country used for administrative or other purposes, in certain modern nations. The term is derived from the Old French conté or cunté denoting a jurisdiction under the sovereignty of a count or a viscount. The modern French is comté , and its equivalents in other languages are contea , contado , comtat , condado , Grafschaft , graafschap , Gau , etc. . When the Normans conquered England, they brought the term with them. The Saxons had already established the districts that became the historic counties of England, calling them shires; many county names derive from the name of the county town with the word shire added on: for example, Gloucestershire and Worcestershire. The Anglo-Saxon terms earl and earldom were taken as equivalent to the continental terms ""count"" and ""county"" under the conquering Normans, and over time the two blended and became equivalent. Further, the later-imported term became a synonym for the native Old English word sċīr ) or, in Modern English, shire. Since a shire was an administrative division of the kingdom, the term ""county"" evolved to designate an administrative division of a federal state, as in Germany and the United States, or of a national government in most other modern uses. In the United States and Canada, founded 600 years later on the British traditions, counties are usually an administrative division set by convenient geographical demarcations, which in governance have certain officeholders as a part of the state and provincial mechanisms, including geographically common court systems. A county may be further subdivided into districts, hundreds, townships or other administrative jurisdictions within the county. A county usually, but not always, contains cities, towns, townships, villages, or other municipal corporations, which in most cases are somewhat subordinate or dependent upon county governments. Depending on the nation, municipality, and local geography, municipalities may or may not be subject to direct or indirect county control — the functions of both levels are often consolidated into a city government when the area is densely populated. Outside English-speaking countries, an equivalent of the term county is often used to describe subnational jurisdictions that are structurally equivalent to counties in the relationship they have with their national government; but which may not be administratively equivalent to counties in predominantly English-speaking countries."	geographical and administrative region in some countries	wikipedia
County	county	(United States) the largest administrative district within a state	county	wordnet
County	county	a territorial division of some countries, forming the chief unit of local administration.	NA	owlbot
County	county	A county is a region	NA	GenericsKB
Bakhsh	bakhsh	A bakhsh is a type of administrative division of Iran. While sometimes translated as county, it should be more accurately translated as district, similar to a township in the United States or a district of England. In Iran, each ostan or province consists of several shahrestan or counties , and each shahrestan has one or more bakhsh or districts. A bakhsh usually consists of dozens of villages with a central town or city. The official governor of a bakhsh is called a bakhshdar , which is the head of bakhshdari office. There are usually a few cities and dehestans in each county. Dehestans are a collection of a number of villages and their surrounding lands. One of the cities of the county is named the capital of each county. To better understand such subdivisions, the following table may be helpful: Assume that province P is divided into two counties: A and B. County A has 3 districts: Central, X, and Y. The Central district is the district that contains City M, the capital of the county. Each district might contain one or more cities or one or more Rural Agglomerations . In this example, the Central district contains City M, City N, and RA T composed of the villages V1, V2, V3, and V4, in turn; district X contains City O and RA U; and district Y has no cities and one RA V. The minimal county consists of only one city as the only district, named Central. The county B in the following table is of such type, containing only one city Q.	administrative division of Iran	wikipedia
Bakhsh	bakhsh			wordnet
Mashhad-Sanabad-Tus	mashhad	"Mashhad ), also spelled Mashad or Meshad , is the second-most-populous city in Iran and the capital of Khorasan-e Razavi Province. It is located in the northeast of the country. It has a population of 3,001,184 , which includes the areas of Mashhad Taman and Torqabeh. It was a major oasis along the ancient Silk Road connecting with Merv to the east. The city is named after the shrine of Imam Reza, the eighth Shia Imam. The Imam was buried in a village in Khorasan, which afterward gained the name Mashhad, meaning the place of martyrdom. Every year, millions of pilgrims visit the Imam Reza shrine. The Abbasid caliph Harun al-Rashid is also buried within the same shrine. Mashhad has been governed by different ethnic groups over the course of its history. The city enjoyed relative prosperity in the Mongol period. Mashhad is also known colloquially as the city of Ferdowsi, after the Iranian poet who composed the Shahnameh. The city is the hometown of some of the most significant Iranian literary figures and artists, such as the poet Mehdi Akhavan-Sales, and Mohammad-Reza Shajarian, the traditional Iranian singer and composer. Ferdowsi and Akhavan-Sales are both buried in Tus, an ancient city that is considered to be the main origin of the current city of Mashhad. On 30 October 2009 , Iran's then- President Mahmoud Ahmadinejad declared Mashhad to be ""Iran's spiritual capital""."	capital city of Razavi Khorasan Province, and second largest city in Iran	wikipedia
Mashhad-Sanabad-Tus	sanabad	Sanabad is a village in Barzavand Rural District, in the Central District of Ardestan County, Isfahan Province, Iran. At the 2006 census, its population was 15, in 9 families.	village in Iran	wikipedia
Mashhad-Sanabad-Tus	tus	"Tokyo University of Science , formerly ""Science University of Tokyo"" or TUS, informally Rikadai or simply Ridai is a private research university located in Shinjuku, Tokyo, Japan"	university	wikipedia
Mashhad-Sanabad-Tus	mashhad	the holy city of Shiite Muslims; located in northeastern Iran	Mashhad, Meshed	wordnet
Mashhad-Sanabad-Tus	sanabad			wordnet
Mashhad-Sanabad-Tus	tus			wordnet
Mayor	mayor	In many countries, a mayor is the highest-ranking official in a municipal government such as that of a city or a town. Worldwide, there is a wide variance in local laws and customs regarding the powers and responsibilities of a mayor as well as the means by which a mayor is elected or otherwise mandated. Depending on the system chosen, a mayor may be the chief executive officer of the municipal government, may simply chair a multi-member governing body with little or no independent power, or may play a solely ceremonial role. Options for selection of a mayor include direct election by the public, or selection by an elected governing council or board.	head of municipal government such as a town or city	wikipedia
Mayor	mayor	the head of a city government	mayor, city_manager	wordnet
Mayor	mayor	(in England, Wales, and Northern Ireland) the head of a town, borough, or county council, elected by council members and generally having purely ceremonial duties.	NA	owlbot
Mayor	mayor	A mayor is civil authority	NA	GenericsKB
City Council	city council	A city council , town council , town board , or board of aldermen is the legislative body that governs a city, town, municipality, or local government area.	legislative body that governs a city, municipality or local government area	wikipedia
City Council	city	a large and densely populated urban area; may include several independent administrative districts	city, metropolis, urban_center	wordnet
City Council	council	(Christianity) an assembly of theologians and bishops and other representatives of different churches or dioceses that is convened to regulate matters of discipline or doctrine	council	wordnet
City Council	city council	City councils are councils	NA	GenericsKB
City	city	A city is a large human settlement. It can be defined as a permanent and densely settled place with administratively defined boundaries whose members work primarily on non-agricultural tasks. Cities generally have extensive systems for housing, transportation, sanitation, utilities, land use, and communication. Their density facilitates interaction between people, government organisations and businesses, sometimes benefiting different parties in the process, such as improving efficiency of goods and service distribution. This concentration also can have significant negative consequences, such as forming urban heat islands, concentrating pollution, and stressing water supplies and other resources. Historically, city-dwellers have been a small proportion of humanity overall, but following two centuries of unprecedented and rapid urbanisation, roughly half of the world population now lives in cities, which has had profound consequences for global sustainability. Present-day cities usually form the core of larger metropolitan areas and urban areas—creating numerous commuters traveling towards city centres for employment, entertainment, and edification. However, in a world of intensifying globalisation, all cities are to varying degrees also connected globally beyond these regions. This increased influence means that cities also have significant influences on global issues, such as sustainable development, global warming and global health. Other important traits of cities besides population include the capital status and relative continued occupation of the city. For example, country capitals such as Abu Dhabi, Beijing, Berlin, Cairo, London, Moscow, Paris, Rome, Seoul, Tokyo, Taipei, and Washington, D.C. reflect their nation's identity. Some historic capitals, such as Kyoto, maintain their reflection of cultural identity even without modern capital status. Religious holy sites offer another example of capital status within a religion, Jerusalem, Mecca, and Varanasi each hold significance. The cities of Faiyum, Damascus, and Argos are among those laying claim to the longest continual inhabitation. In terms of relative age, the oldest cities in the Americas are Cholula near Puebla, Florés in Petén, and Acoma near Albuquerque, while the oldest capital cities in the Americas are Mexico City, Santo Domingo, and San Juan. Another example of relative age, is in the age of the oldest capital cities of the superpower and emerging superpower, they are the U.S. state capital of Santa Fe, New Mexico, and the Chinese prefecture capital of Xi'an, Shaanxi.	large permanent human settlement	wikipedia
City	city	a large and densely populated urban area; may include several independent administrative districts	city, metropolis, urban_center	wordnet
City	city	a large town.	NA	owlbot
City	city	A city is a municipality	NA	GenericsKB
Elevation	elevation	The elevation of a geographic location is its height above or below a fixed reference point, most commonly a reference geoid, a mathematical model of the Earth's sea level as an equipotential gravitational surface . The term elevation is mainly used when referring to points on the Earth's surface, while altitude or geopotential height is used for points above the surface, such as an aircraft in flight or a spacecraft in orbit, and depth is used for points below the surface. Elevation is not to be confused with the distance from the center of the Earth. Due to the equatorial bulge, the summits of Mount Everest and Chimborazo have, respectively, the largest elevation and the largest geocentric distance.	height above a fixed reference point	wikipedia
Elevation	elevation	distance of something above a reference point (such as sea level)	elevation	wordnet
Elevation	elevation	height above a given level, especially sea level.	NA	owlbot
Elevation	elevation	Elevation affects climate and temperature which determines where plants and animals live	NA	GenericsKB
Urban	urban	Urban as a given name or surname may refer:	given name, surname	wikipedia
Urban	urban	located in or characteristic of a city or city life	urban	wordnet
Urban	urban	in, relating to, or characteristic of a town or city.	NA	owlbot
Metro	metro	Ahmedabad Metro is a rapid transit system for the cities of Ahmedabad, Gandhinagar in Gujarat, India	metro system in Ahmedabad, India	wikipedia
Metro	metro	an electric railway operating below the surface of the ground (usually in a city)	metro, tube, underground, subway_system, subway	wordnet
Metro	metro	an underground railway system in a city, especially Paris.	NA	owlbot
Metro	metro	Metros are railways	NA	GenericsKB
Population Rank in Iran	population	In biology, a population is all the organisms of the same group or species who live in a particular geographical area and are capable of interbreeding. The area of a sexual population is the area where inter-breeding is possible between any pair within the area and more probable than cross-breeding with individuals from other areas. In sociology, population refers to a collection of humans. Demography is a social science which entails the statistical study of populations. Population, in simpler terms, is the number of people in a city or town, region, country or world; population is usually determined by a process called census .	ensemble of individuals of a species in an area, or their number	wikipedia
Population Rank in Iran	rank	Diplomatic rank is a system of professional and social rank used in the world of diplomacy and international relations	system of professional and social rank used in the world of diplomacy and international relations	wikipedia
Population Rank in Iran	iran	"Iran ), also called Persia , and officially the Islamic Republic of Iran ), is a country in Western Asia. It is bordered to the northwest by Armenia and Azerbaijan, to the north by the Caspian Sea, to the northeast by Turkmenistan, to the east by Afghanistan and Pakistan, to the south by the Persian Gulf and the Gulf of Oman, and to the west by Turkey and Iraq. Its central location in Eurasia and proximity to the Strait of Hormuz give it significant geostrategic importance. Tehran is the capital and largest city, as well as the leading economic and cultural hub; it is also the most populous city in Western Asia, with more than 8.8 million residents, and up to 15 million including the metropolitan area. With 83 million inhabitants, Iran is the world's 17th most populous country. Spanning 1,648,195 km2 , it is the second largest country in the Middle East and the 17th largest in the world. Iran is home to one of the world's oldest civilizations, beginning with the formation of the Elamite kingdoms in the fourth millennium BC. It was first unified by the Iranian Medes in the seventh century BC, and reached its territorial height in the sixth century BC, when Cyrus the Great founded the Achaemenid Empire, which stretched from Eastern Europe to the Indus Valley, making it one of the largest empires in history. The empire fell to Alexander the Great in the fourth century BC and was divided into several Hellenistic states. An Iranian rebellion established the Parthian Empire in the third century BC, which was succeeded in the third century AD by the Sasanian Empire, a major world power for the next four centuries. Arab Muslims conquered the empire in the seventh century AD, and the subsequent Islamization of Iran led to the decline of the once dominant Zoroastrian religion. Iran subsequently became a major center of Islamic culture and learning, with its art, literature, philosophy, and architecture spreading across the Muslim world and beyond during the Islamic Golden Age. Over the next two centuries, a series of native Muslim dynasties emerged before the Seljuq Turks and the Ilkhanate Mongols conquered the region. In the 15th century, the native Safavids reestablished a unified Iranian state and national identity, with the country's conversion to Shia Islam marking a turning point in Iranian and Muslim history. Under the reign of Nader Shah in the 18th century, Iran once again became a major world power, though by the 19th century a series of conflicts with the Russian Empire led to significant territorial losses. However, Iran would remain one of the few non-European states to avoid colonization by Europe. The early 20th century saw the Persian Constitutional Revolution, which created the country's first constitutional monarchy and legislature, and a gradual move towards greater democracy. Efforts to nationalize its fossil fuel supply from Western companies led to an Anglo-American coup in 1953, which resulted in greater autocratic rule under Mohammad Reza Pahlavi and growing Western political influence. He went on to launch a far-reaching series of reforms in 1963, which included industrial growth, infrastructure expansion, land reforms, and increased women's rights. However, widespread dissatisfaction with the monarchy culminated in the Iranian Revolution, which established the current Islamic Republic in 1979. Iran was invaded by Iraq in 1980, leading to a bloody and protracted war that lasted for almost eight years, and ended in a stalemate with devastating losses for both sides. Iran's political system combines elements of a presidential democracy and an Islamic theocracy, with the ultimate authority vested in an autocratic ""Supreme Leader"". The Iranian government is widely considered to be authoritarian, with significant constraints and abuses against human rights and civil liberties, including the violent suppression of mass protests, unfair elections, and unequal rights for women and children. Iran is a founding member of the UN, ECO, OIC, and OPEC. It is a major regional and middle power, and its large reserves of fossil fuels—including the world's largest natural gas supply and the third largest proven oil reserves—exert considerable influence in international energy security and the world economy. The country's rich cultural legacy is reflected in part by its 22 UNESCO World Heritage Sites, the third largest number in Asia and 10th largest in the world. Historically a multi-ethnic country, Iran remains a pluralistic society comprising numerous ethnic, linguistic, and religious groups, the largest being Persians, Azeris, Kurds, Mazandaranis and Lurs."	sovereign state in Western Asia	wikipedia
Population Rank in Iran	population	the number of inhabitants (either the total number or the number of a particular race or class) in a given place (country or city etc.)	population	wordnet
Population Rank in Iran	rank	relative status	rank	wordnet
Population Rank in Iran	iran	a theocratic Islamic republic in the Middle East in western Asia; Iran was the core of the ancient empire that was known as Persia until 1935; rich in oil	Iran, Islamic_Republic_of_Iran, Persia	wordnet
Population Rank in Iran	population	Population can also be the source of many problems like starvation and lack of housing	NA	GenericsKB
Population Rank in Iran	rank	Rank is status	NA	GenericsKB
Population Rank in Iran	iran	Iran has (part) Caspian	NA	GenericsKB
Tourists	tourists	"Tourism is travel for pleasure or business; also the theory and practice of touring, the business of attracting, accommodating, and entertaining tourists, and the business of operating tours. The World Tourism Organization defines tourism more generally, in terms which go ""beyond the common perception of tourism as being limited to holiday activity only"", as people ""traveling to and staying in places outside their usual environment for not more than one consecutive year for leisure and not less than 24 hours, business and other purposes"". Tourism can be domestic or international, and international tourism has both incoming and outgoing implications on a country's balance of payments. Tourism numbers declined as a result of a strong economic slowdown between the second half of 2008 and the end of 2009, and in consequence of the outbreak of the 2009 H1N1 influenza virus, but slowly recovered. Globally, international tourism receipts grew to US$1.03 trillion in 2005, corresponding to an increase in real terms of 3.8% from 2010. International tourist arrivals surpassed the milestone of 1 billion tourists globally for the first time in 2012, emerging source markets such as China, Russia, and Brazil had significantly increased their spending over the previous decade. The ITB Berlin is the world's leading tourism trade-fair. Global tourism accounts for c. 8% of global greenhouse-gas emissions. *: circa"	travel for recreational or leisure purposes	wikipedia
Tourists	tourists	someone who travels for pleasure	tourist, tourer, holidaymaker	wordnet
Tourists	tourists	a person who is travelling or visiting a place for pleasure.	NA	owlbot
Tourists	tourist	Tourist means someone who learns about other places	NA	GenericsKB
