key	keyword	definition	description	source
Coordinates	coordinates	"In geometry, a coordinate system is a system that uses one or more numbers, or coordinates , to uniquely determine the position of the points or other geometric elements on a manifold such as Euclidean space. The order of the coordinates is significant, and they are sometimes identified by their position in an ordered tuple and sometimes by a letter, as in ""the x -coordinate"". The coordinates are taken to be real numbers in elementary mathematics, but may be complex numbers or elements of a more abstract system such as a commutative ring. The use of a coordinate system allows problems in geometry to be translated into problems about numbers and vice versa ; this is the basis of analytic geometry."	System for determining the position of a point by a tuple of scalars	wikipedia
Coordinates	coordinates	a number that identifies a position relative to an axis	coordinate, co-ordinate	wordnet
Coordinates	coordinates	bring the different elements of (a complex activity or organization) into a harmonious or efficient relationship.	NA	owlbot
Country	country	"The term country refers to a political state, nation, or controlled territory. It is often referred to as the land of an individual's birth, residence, or citizenship. A country may be an independent sovereign state or part of a larger state, as a non-sovereign or formerly sovereign political division, a physical territory with a government, or a geographic region associated with sets of previously independent or differently associated people with distinct political characteristics. It is not inherently sovereign. Countries can refer both to sovereign states and to other political entities, while other times it can refer only to states. For example, the CIA World Factbook uses the word in its ""Country name"" field to refer to ""a wide variety of dependencies, areas of special sovereignty, uninhabited islands, and other entities in addition to the traditional countries or independent states"". The largest country in the world is Russia, while the most populous is China, followed by India and the United States of America. The newest country is South Sudan."	distinct region in geography; a broad term that can include political divisions or regions associated with distinct political characteristics	wikipedia
Country	country	the territory occupied by a nation	country, state, land	wordnet
Country	country	districts and small settlements outside large urban areas or the capital.	NA	owlbot
Country	country	A country is an unit	NA	GenericsKB
Province	province	"A province is almost always an administrative division within a country or state. The term derives from the ancient Roman provincia , which was the major territorial and administrative unit of the Roman Empire's territorial possessions outside Italy. The term province has since been adopted by many countries. In some countries with no actual provinces, ""the provinces"" is a metaphorical term meaning ""outside the capital city"". While some provinces were produced artificially by colonial powers, others were formed around local groups with their own ethnic identities. Many have their own powers independent of central or federal authority, especially in Canada. In other countries, like China or France, provinces are the creation of central government, with very little autonomy."	first-level administrative division in several countries	wikipedia
Province	province	the territory occupied by one of the constituent administrative districts of a nation	state, province	wordnet
Province	province	a principal administrative division of a country or empire.	NA	owlbot
Province	province	A province is a district	NA	GenericsKB
District	district	"A district is a type of administrative division that, in some countries, is managed by local government. Across the world, areas known as ""districts"" vary greatly in size, spanning regions or counties, several municipalities, subdivisions of municipalities, school district, or political district."	type of administrative division, in some countries	wikipedia
District	district	regulate housing in; of certain areas of towns	zone, district	wordnet
District	district	an area of a country or city, especially one characterized by a particular feature or activity.	NA	owlbot
District	district	A district is a region	NA	GenericsKB
Settled	settled	A settler is a person who has migrated to an area and established a permanent residence there, often to colonize the area. It is also used to describe people whose ancestors migrated to a new area, or who were born into an already established settler colony. Settlers are generally from a sedentary culture, as opposed to nomadic peoples who may move settlements seasonally, within traditional territories. Settlement usually relies on dispossession of already established populations within the contested area, and because of this it can be a very violent process. Many times settlers are backed by governments or large countries.	person who has migrated to an area and established permanent residence there	wikipedia
Settled	settled	take up residence and become established	settle, locate	wordnet
Settled	settled	pay (a debt or account).	NA	owlbot
Settled	settle	A settle is a bench	NA	GenericsKB
Incorporated (town)	incorporated	A corporation is an organization—usually a group of people or a company—authorized by the state to act as a single entity and recognized as such in law for certain purposes	separate legal entity that has been incorporated through a legislative or registration process established through legislation	wikipedia
Incorporated (town)	incorporated	organized and maintained as a legal corporation	corporate, incorporated	wordnet
Incorporated (town)	incorporated	(of a company or other organization) formed into a legal corporation.	NA	owlbot
Incorporated (city)	incorporated	A corporation is an organization—usually a group of people or a company—authorized by the state to act as a single entity and recognized as such in law for certain purposes	separate legal entity that has been incorporated through a legislative or registration process established through legislation	wikipedia
Incorporated (city)	incorporated	organized and maintained as a legal corporation	corporate, incorporated	wordnet
Incorporated (city)	incorporated	(of a company or other organization) formed into a legal corporation.	NA	owlbot
Divisions	divisions	A beam compass is a compass with a beam and sliding sockets or cursors for drawing and dividing circles larger than those made by a regular pair of compasses	NA	wikipedia
Divisions	divisions	an administrative unit in government or business	division	wordnet
Divisions	divisions	the action of separating something into parts or the process of being separated.	NA	owlbot
Divisions	division	Division involves separation	NA	GenericsKB
Type	type	Categorization is an activity that consists of putting things into categories based on their similarities or common criteria	cognitive process in which ideas and objects are recognized, differentiated, and understood	wikipedia
Type	type	(biology) the taxonomic group whose characteristics are used to define the next higher taxon	type	wordnet
Type	type	a person or thing exemplifying the ideal or defining characteristics of something.	NA	owlbot
Type	type	A type is a kind	NA	GenericsKB
Mayor	mayor	In many countries, a mayor is the highest-ranking official in a municipal government such as that of a city or a town. Worldwide, there is a wide variance in local laws and customs regarding the powers and responsibilities of a mayor as well as the means by which a mayor is elected or otherwise mandated. Depending on the system chosen, a mayor may be the chief executive officer of the municipal government, may simply chair a multi-member governing body with little or no independent power, or may play a solely ceremonial role. Options for selection of a mayor include direct election by the public, or selection by an elected governing council or board.	head of municipal government such as a town or city	wikipedia
Mayor	mayor	the head of a city government	mayor, city_manager	wordnet
Mayor	mayor	(in England, Wales, and Northern Ireland) the head of a town, borough, or county council, elected by council members and generally having purely ceremonial duties.	NA	owlbot
Mayor	mayor	A mayor is civil authority	NA	GenericsKB
City	city	A city is a large human settlement. It can be defined as a permanent and densely settled place with administratively defined boundaries whose members work primarily on non-agricultural tasks. Cities generally have extensive systems for housing, transportation, sanitation, utilities, land use, and communication. Their density facilitates interaction between people, government organisations and businesses, sometimes benefiting different parties in the process, such as improving efficiency of goods and service distribution. This concentration also can have significant negative consequences, such as forming urban heat islands, concentrating pollution, and stressing water supplies and other resources. Historically, city-dwellers have been a small proportion of humanity overall, but following two centuries of unprecedented and rapid urbanisation, roughly half of the world population now lives in cities, which has had profound consequences for global sustainability. Present-day cities usually form the core of larger metropolitan areas and urban areas—creating numerous commuters traveling towards city centres for employment, entertainment, and edification. However, in a world of intensifying globalisation, all cities are to varying degrees also connected globally beyond these regions. This increased influence means that cities also have significant influences on global issues, such as sustainable development, global warming and global health. Other important traits of cities besides population include the capital status and relative continued occupation of the city. For example, country capitals such as Abu Dhabi, Beijing, Berlin, Cairo, London, Moscow, Paris, Rome, Seoul, Tokyo, Taipei, and Washington, D.C. reflect their nation's identity. Some historic capitals, such as Kyoto, maintain their reflection of cultural identity even without modern capital status. Religious holy sites offer another example of capital status within a religion, Jerusalem, Mecca, and Varanasi each hold significance. The cities of Faiyum, Damascus, and Argos are among those laying claim to the longest continual inhabitation. In terms of relative age, the oldest cities in the Americas are Cholula near Puebla, Florés in Petén, and Acoma near Albuquerque, while the oldest capital cities in the Americas are Mexico City, Santo Domingo, and San Juan. Another example of relative age, is in the age of the oldest capital cities of the superpower and emerging superpower, they are the U.S. state capital of Santa Fe, New Mexico, and the Chinese prefecture capital of Xi'an, Shaanxi.	large permanent human settlement	wikipedia
City	city	a large and densely populated urban area; may include several independent administrative districts	city, metropolis, urban_center	wordnet
City	city	a large town.	NA	owlbot
City	city	A city is a municipality	NA	GenericsKB
Water	water	"Water is an inorganic, transparent, tasteless, odorless, and nearly colorless chemical substance, which is the main constituent of Earth's hydrosphere and the fluids of all known living organisms. It is vital for all known forms of life, even though it provides no calories or organic nutrients. Its chemical formula is H2O, meaning that each of its molecules contains one oxygen and two hydrogen atoms, connected by covalent bonds. ""Water"" is the name of the liquid state of H2O at standard ambient temperature and pressure. It forms precipitation in the form of rain and aerosols in the form of fog. Clouds are formed from suspended droplets of water and ice, its solid state. When finely divided, crystalline ice may precipitate in the form of snow. The gaseous state of water is steam or water vapor. Water moves continually through the water cycle of evaporation, transpiration , condensation, precipitation, and runoff, usually reaching the sea. Water covers 71% of the Earth's surface, mostly in seas and oceans. Small portions of water occur as groundwater , in the glaciers and the ice caps of Antarctica and Greenland , and in the air as vapor, clouds , and precipitation . Water plays an important role in the world economy. Approximately 70% of the freshwater used by humans goes to agriculture. Fishing in salt and fresh water bodies is a major source of food for many parts of the world. Much of the long-distance trade of commodities is transported by boats through seas, rivers, lakes, and canals. Large quantities of water, ice, and steam are used for cooling and heating, in industry and homes. Water is an excellent solvent for a wide variety of substances both mineral and organic; as such it is widely used in industrial processes, and in cooking and washing. Water, ice and snow are also central to many sports and other forms of entertainment, such as swimming, pleasure boating, boat racing, surfing, sport fishing, diving, ice skating and skiing."	chemical compound; main constituent of the fluids of most living organisms	wikipedia
Water	water	a facility that provides a source of water	water_system, water_supply, water	wordnet
Water	water	urine.	NA	owlbot
Water	water	Water absorbs carbon dioxide	NA	GenericsKB
Urban	urban	Urban as a given name or surname may refer:	given name, surname	wikipedia
Urban	urban	located in or characteristic of a city or city life	urban	wordnet
Urban	urban	in, relating to, or characteristic of a town or city.	NA	owlbot
Metro	metro	The Algiers Metro , serving Algiers, the capital of Algeria, is a rapid transit system dating from the 1970s that was designed to address the need for mass transport caused by the city's growth	Rapid transit system in Algiers	wikipedia
Metro	metro	an electric railway operating below the surface of the ground (usually in a city)	metro, tube, underground, subway_system, subway	wordnet
Metro	metro	an underground railway system in a city, especially Paris.	NA	owlbot
Metro	metro	Metros are railways	NA	GenericsKB
Elevation	elevation	The elevation of a geographic location is its height above or below a fixed reference point, most commonly a reference geoid, a mathematical model of the Earth's sea level as an equipotential gravitational surface . The term elevation is mainly used when referring to points on the Earth's surface, while altitude or geopotential height is used for points above the surface, such as an aircraft in flight or a spacecraft in orbit, and depth is used for points below the surface. Elevation is not to be confused with the distance from the center of the Earth. Due to the equatorial bulge, the summits of Mount Everest and Chimborazo have, respectively, the largest elevation and the largest geocentric distance.	height above a fixed reference point	wikipedia
Elevation	elevation	distance of something above a reference point (such as sea level)	elevation	wordnet
Elevation	elevation	height above a given level, especially sea level.	NA	owlbot
Elevation	elevation	Elevation affects climate and temperature which determines where plants and animals live	NA	GenericsKB
Density	density	"The density , of a substance is its mass per unit volume. The symbol most often used for density is ρ , although the Latin letter D can also be used. Mathematically, density is defined as mass divided by volume: ρ = m V {\displaystyle \rho ={\frac {m}{V}}} where ρ is the density, m is the mass, and V is the volume. In some cases , density is loosely defined as its weight per unit volume, although this is scientifically inaccurate – this quantity is more specifically called specific weight. For a pure substance the density has the same numerical value as its mass concentration. Different materials usually have different densities, and density may be relevant to buoyancy, purity and packaging. Osmium and iridium are the densest known elements at standard conditions for temperature and pressure. To simplify comparisons of density across different systems of units, it is sometimes replaced by the dimensionless quantity ""relative density"" or ""specific gravity"", i.e. the ratio of the density of the material to that of a standard material, usually water. Thus a relative density less than one means that the substance floats in water. The density of a material varies with temperature and pressure. This variation is typically small for solids and liquids but much greater for gases. Increasing the pressure on an object decreases the volume of the object and thus increases its density. Increasing the temperature of a substance decreases its density by increasing its volume. In most materials, heating the bottom of a fluid results in convection of the heat from the bottom to the top, due to the decrease in the density of the heated fluid. This causes it to rise relative to more dense unheated material. The reciprocal of the density of a substance is occasionally called its specific volume, a term sometimes used in thermodynamics. Density is an intensive property in that increasing the amount of a substance does not increase its density; rather it increases its mass."	mass per volume	wikipedia
Density	density	the amount per unit size	density, denseness	wordnet
Density	density	the quantity of people or things in a given area or space.	NA	owlbot
Density	density	Densities apply to gross developable acreage	NA	GenericsKB
Urban density	urban density	Urban density is a term used in urban planning and urban design to refer to the number of people inhabiting a given urbanized area. As such it is to be distinguished from other measures of population density. Urban density is considered an important factor in understanding how cities function. Research related to urban density occurs across diverse areas, including economics, health, innovation, psychology and geography as well as sustainability. A 2019 meta-analysis of 180 studies on a vast number of economic outcomes of urban density concluded that urban density had net positive effects but had some regressive distributional effects, which is to say, a negative impact on lower-income residents.		wikipedia
Urban density	urban	located in or characteristic of a city or city life	urban	wordnet
Urban density	density	the amount per unit size	density, denseness	wordnet
Urban density	density	Densities apply to gross developable acreage	NA	GenericsKB
Time zone	time zone	A time zone is a region of the globe that observes a uniform standard time for legal, commercial and social purposes. Time zones tend to follow the boundaries of countries and their subdivisions instead of strictly following longitude because it is convenient for areas in close commercial or other communication to keep the same time. Most of the time zones on land are offset from Coordinated Universal Time by a whole number of hours , but a few zones are offset by 30 or 45 minutes . Some higher latitude and temperate zone countries use daylight saving time for part of the year, typically by adjusting local clock time by an hour. Many land time zones are skewed toward the west of the corresponding nautical time zones. This also creates permanent daylight saving time effect.	region on Earth that has a uniform standard time for legal, commercial, and social purposes	wikipedia
Time zone	time	the continuum of experience in which events pass from the future through the present to the past	time	wordnet
Time zone	zone	(anatomy) any encircling or beltlike structure	zone, zona	wordnet
Time zone	time zone	Time zone objects represent geopolitical regions	NA	GenericsKB
Summer (DST)	summer	Summer is the hottest of the four temperate seasons, falling after spring and before autumn. At or around the summer solstice , the earliest sunrise and latest sunset occurs, the days are longest and the nights are shortest, with day length decreasing as the season progresses after the solstice. The date of the beginning of summer varies according to climate, tradition, and culture. When it is summer in the Northern Hemisphere, it is winter in the Southern Hemisphere, and vice versa.	Warmest of the four temperate seasons, beginning or centered around the summer solstice	wikipedia
Summer (DST)	summer	the period of finest development, happiness, or beauty	summer	wordnet
Summer (DST)	summer	the warmest season of the year, in the northern hemisphere from June to August and in the southern hemisphere from December to February.	NA	owlbot
Summer (DST)	summer	Summer also means insect season	NA	GenericsKB
Area code(s)	area code	A telephone numbering plan is a type of numbering scheme used in telecommunication to assign telephone numbers to subscriber telephones or other telephony endpoints. Telephone numbers are the addresses of participants in a telephone network, reachable by a system of destination code routing. Telephone numbering plans are defined in each of administrative regions of the public switched telephone network and they are also present in private telephone networks. For public number systems, geographic location plays a role in the sequence of numbers assigned to each telephone subscriber. Many numbering plans subdivide their territory of service into geographic regions designated by a prefix, often called an area code or city code , which is a set of digits forming the most-significant part of the dialing sequence to reach a telephone subscriber. Numbering plans may follow a variety of design strategies which have often arisen from the historical evolution of individual telephone networks and local requirements. A broad division is commonly recognized between closed numbering plans, such as found in North America, which feature fixed-length area codes and local numbers, while open numbering plans feature a variance in the length of the area code, local number, or both of a telephone number assigned to a subscriber line. The International Telecommunication Union has established a comprehensive numbering plan, designated E.164, for uniform interoperability of the networks of its member state or regional administrations. It is an open numbering plan, however, imposing a maximum length of 15 digits to telephone numbers. The standard defines a country calling code for each state or region which is prefixed to each national numbering plan telephone number for international destination routing. Private numbering plans exist in telephone networks that are privately operated in an enterprise or organizational campus. Such systems may be supported by a private branch exchange , which provides a central access point to the PSTN and also controls internal calls between telephone extensions. In contrast to numbering plans, which determine telephone numbers assigned to subscriber stations, dialing plans establish the customer dialing procedures, i.e., the sequence of digits or symbols to be dialed to reach a destination. It is the manner in which the numbering plan is used. Even in closed numbering plans, it is not always necessary to dial all digits of a number. For example, an area code may often be omitted when the destination is in the same area as the calling station.	type of numbering scheme used in telecommunication to assign telephone numbers to subscriber telephones or other telephony endpoints	wikipedia
Area code(s)	area	the extent of a 2-dimensional surface enclosed within a boundary	area, expanse, surface_area	wordnet
Area code(s)	code	(computer science) the symbolic arrangement of data or instructions in a computer program or the set of such instructions	code, computer_code	wordnet
Area code(s)	area code	Area code is code	NA	GenericsKB
HDI (2017)	hdi	"The Human Development Index is a statistic composite index of life expectancy, education , and per capita income indicators, which are used to rank countries into four tiers of human development. A country scores a higher HDI when the lifespan is higher, the education level is higher, and the gross national income GNI per capita is higher. It was developed by Indian economist Amartya Sen and then utilised by Pakistani economist Mahbub ul Haq and was further used to measure a country's development by the United Nations Development Programme 's Human Development Report Office. The 2010 Human Development Report introduced an Inequality-adjusted Human Development Index . While the simple HDI remains useful, it stated that ""the IHDI is the actual level of human development "", and ""the HDI can be viewed as an index of 'potential' human development "". The index does not take into account several factors, such as the net wealth per capita or the relative quality of goods in a country. This situation tends to lower the ranking for some of the most advanced countries, such as the G7 members and others. The index is based on the human development approach, developed by Mahbub ul Haq, often framed in terms of whether people are able to ""be"" and ""do"" desirable things in life. Examples include—Being: well fed, sheltered, healthy; Doing: work, education, voting, participating in community life. The freedom of choice is central—someone choosing to be hungry is quite different from someone who is hungry because they cannot afford to buy food, or because the country is in a famine."	composite statistic of life expectancy, education, and income indices	wikipedia
HDI (2017)	hdi			wordnet
