key	keyword	definition	description	source
Affliliation	affliliation			wordnet
In Office 1	office	"An office is generally a room or other area where an organization's employees perform administrative work in order to support and realize objects and goals of the organization. The word ""office"" may also denote a position within an organization with specific duties attached to it ; the latter is in fact an earlier usage, office as place originally referring to the location of one's duty. When used as an adjective, the term ""office"" may refer to business-related tasks. In law, a company or organization has offices in any place where it has an official presence, even if that presence consists of a storage silo rather than an establishment with desk-and-chair. An office is also an architectural and design phenomenon: ranging from a small office such as a bench in the corner of a small business of extremely small size , through entire floors of buildings, up to and including massive buildings dedicated entirely to one company. In modern terms an office is usually the location where white-collar workers carry out their functions. As per James Stephenson, ""Office is that part of business enterprise which is devoted to the direction and co-ordination of its various activities."" Offices in classical antiquity were often part of a palace complex or of a large temple. The High Middle Ages saw the rise of the medieval chancery, which was usually the place where most government letters were written and where laws were copied in the administration of a kingdom. With the growth of large, complex organizations in the 18th century, the first purpose-built office spaces were constructed. As the Industrial Revolution intensified in the 18th and 19th centuries, the industries of banking, rail, insurance, retail, petroleum, and telegraphy grew dramatically, requiring many clerks, and as a result more office space was assigned to house their activities. The time-and-motion study, pioneered in manufacturing by F. W. Taylor led to the ""Modern Efficiency Desk"" of 1915 with a flat top and drawers below, designed to allow managers an easy view of the workers. However, by the middle of the 20th century, it became apparent that an efficient office required discretion in the control of privacy, and gradually the cubicle system evolved. The main purpose of an office environment is to support its occupants in performing their jobs. Work spaces in an office are typically used for conventional office activities such as reading, writing and computer work. There are nine generic types of work space, each supporting different activities. In addition to individual cubicles, one can find meeting rooms, lounges, and spaces for support activities, such as photocopying and filing. Some offices also have a kitchen area where workers can make their lunches. There are many different ways of arranging the space in an office and whilst these vary according to function, managerial fashions and the culture of specific companies can be even more important. While offices can be built in almost any location and in almost any building, some modern requirements for offices make this more difficult, such as requirements for light, networking, and security. The major purpose of an office building is to provide a workplace and working environment - primarily for administrative and managerial workers. These workers usually occupy set areas within the office building, and usually are provided with desks, PCs and other equipment they may need within these areas."	room where people perform their duties or a position within an organization	wikipedia
In Office 1	office	(of a government or government official) holding an office means being in power	office, power	wordnet
In Office 1	office	a position of authority or service, typically one of a public nature.	NA	owlbot
In Office 1	office	An office is an establishment	NA	GenericsKB
President	president	Four ships and two shore establishments of the Royal Navy have been named HMS Buzzard after the bird, the buzzard:	Wikimedia disambiguation page	wikipedia
President	president	the office of the United States head of state	President_of_the_United_States, President, Chief_Executive	wordnet
President	president	the elected head of a republican state.	NA	owlbot
President	president	A president is a business executive	NA	GenericsKB
Preceded by	preceded	furnish with a preface or introduction	precede, preface, premise, introduce	wordnet
Preceded by	preceded	come before (something) in time.	NA	owlbot
Succeeded by	succeed	The United Chinese Community Enrichment Services Society or S	NA	wikipedia
Succeeded by	succeeded	be the successor (of)	succeed, come_after, follow	wordnet
Succeeded by	succeeded	take over a throne, office, or other position from.	NA	owlbot
Born	born	""" Born "" is a song written and performed by Barry Gibb that was included as the first track on his debut album The Kid's No Good in 1970"	song written and performed by Barry Gibb	wikipedia
Born	born	bring forth,	bear, turn_out	wordnet
Born	born	existing as a result of birth.	NA	owlbot
Born	born	Borns start with cries	NA	GenericsKB
Nationality	nationality	Nationality is a legal relationship between an individual person and a state. Nationality affords the state jurisdiction over the person and affords the person the protection of the state. What these rights and duties are varies from state to state. This relationship generally enables intervention by a State to provide help and protection to its nationals when they are harmed by other States. By custom and international conventions, it is the right of each state to determine who its nationals are. Such determinations are part of nationality law. In some cases, determinations of nationality are also governed by public international law—for example, by treaties on statelessness and the European Convention on Nationality. Nationality differs technically and legally from citizenship, which is a different legal relationship between a person and a country. The noun national can include both citizens and non-citizens. The most common distinguishing feature of citizenship is that citizens have the right to participate in the political life of the state, such as by voting or standing for election. However, in most modern countries all nationals are citizens of the state, and full citizens are always nationals of the state. In older texts the word nationality , rather than ethnicity , is often used to refer to an ethnic group . This older meaning of nationality is not defined by political borders or passport ownership and includes nations that lack an independent state . Individuals may also be considered nationals of groups with autonomous status that have ceded some power to a larger government.	relationship between an individual human and a state	wikipedia
Nationality	nationality	people having common origins or traditions and often comprising a nation	nationality	wordnet
Nationality	nationality	an ethnic group forming a part of one or more political nations.	NA	owlbot
Nationality	nationality	A nationality is a people	NA	GenericsKB
Political party	political party	A political party is an organized group of people who have the same ideology, or who otherwise have the same political positions, and who field candidates for elections, in an attempt to get them elected and thereby implement the party's agenda. They are a defining element of representative democracy. While there is some international commonality in the way political parties are recognized and in how they operate, there are often many differences, and some are significant. Most of political parties have an ideological core, but some do not, and many represent ideologies very different from their ideology at the time the party was founded. Many countries, such as Germany and India, have several significant political parties, and some nations have one-party systems, such as China and Cuba. The United States is in practice a two-party system but with many smaller parties also participating.	organization that seeks to influence government policy and actions	wikipedia
Political party	political	involving or characteristic of politics or parties or politicians; - Daniel Goleman	political	wordnet
Political party	party	a person involved in legal proceedings	party	wordnet
Political party	political party	Political parties are a reflection of our personality traits	NA	GenericsKB
Other politicalaffiliations	politicalaffiliations			wordnet
Spouse(s)	spouse	A spouse is a significant other in a marriage, civil union, or common-law marriage. The term is gender neutral, whereas a male spouse is a husband and a female spouse is a wife. Although a spouse is a form of significant other, the latter term also includes non-marital partners who play a social role similar to that of a spouse, but do not have rights and duties reserved by law to a spouse.	partner in a marriage, civil union, domestic partnership or common-law marriage	wikipedia
Spouse(s)	spouse	a person's partner in marriage	spouse, partner, married_person, mate, better_half	wordnet
Spouse(s)	spouse	a husband or wife, considered in relation to their partner.	NA	owlbot
Spouse(s)	spouse	A spouse is a relative	NA	GenericsKB
Residence	residence	A home , or domicile , is a living space used as a permanent or semi- permanent residence for an individual, family, household or several families in a tribe	dwelling-place used as a permanent or semi-permanent residence for an individual,family,household or several families in a tribe. It is often a house, apartment, or other building, or alternatively a mobile home,houseboat,yurt, other portable shelter	wikipedia
Residence	residence	the act of dwelling in a place	residency, residence, abidance	wordnet
Residence	residence	a person's home, especially a large and impressive one.	NA	owlbot
Residence	residence	A residence is an address	NA	GenericsKB
Alma mater	alma mater	"Alma mater almae matres ) is an allegorical Latin phrase for a university, school, or college that one formerly attended. In US usage, it can also mean the school from which one graduated. The phrase is variously translated as ""nourishing mother"", ""nursing mother"", or ""fostering mother"", suggesting that a school provides intellectual nourishment to its students. Before its current usage, alma mater was an honorific title for various Latin mother goddesses, especially Ceres or Cybele, and later in Catholicism for the Virgin Mary. It entered academic usage when the University of Bologna adopted the motto Alma Mater Studiorum , which describes its heritage as the oldest operating university in the Western world. It is related to alumnus , a term used for a university graduate that literally means a ""nursling"" or ""one who is nourished"". *: literal translation"	school or university that a person has attended	wikipedia
Alma mater	alma			wordnet
Alma mater	mater	an informal use of the Latin word for mother; sometimes used by British schoolboys or used facetiously	mater	wordnet
Alma mater	alma mater	the university, school, or college that one formerly attended.	NA	owlbot
Alma mater	alma mater	An alma mater is a school	NA	GenericsKB
Occupation	occupation	Employment is a relationship between two parties, usually based on a contract where work is paid for, where one party, which may be a corporation, for profit, not-for-profit organization, co-operative or other entity is the employer and the other is the employee	relationship between the employee and the employer	wikipedia
Occupation	occupation	any activity that occupies a person's attention	occupation	wordnet
Occupation	occupation	a job or profession.	NA	owlbot
Occupation	occupation	An occupation is an activity	NA	GenericsKB
Website	website	A website is a collection of web pages and related content that is identified by a common domain name and published on at least one web server. Notable examples are wikipedia.org, google.com, and amazon.com. All publicly accessible websites collectively constitute the World Wide Web. There are also private websites that can only be accessed on a private network, such as a company's internal website for its employees. Websites are typically dedicated to a particular topic or purpose, such as news, education, commerce, entertainment, or social networking. Hyperlinking between web pages guides the navigation of the site, which often starts with a home page. Users can access websites on a range of devices, including desktops, laptops, tablets, and smartphones. The software application used on these devices is called a web browser.	set of related web pages served from a single web domain	wikipedia
Website	website	a computer connected to the internet that maintains a series of web pages on the World Wide Web	web_site, website, internet_site, site	wordnet
Website	website	A website is a computer	NA	GenericsKB
