key	keyword	definition	description	source
Capitaland largest city	capitaland	CapitaLand Limited is a Singaporean multinational alternative asset management company focusing on real estate, infrastructure and private equity. Headquartered and listed in Singapore, it is one of Asia's largest real estate companies and is the owner and manager of a global portfolio comprising integrated developments, shopping malls, lodging, offices, homes, real estate investment trusts and funds. Present across more than 200 cities in over 30 countries, the company focuses on Singapore and China as its core markets while it continues to expand in markets such as India, Vietnam, Australia, Europe and the USA. The company also has one of the largest investment management businesses globally, and a stable of seven listed real estate investment trusts and business trusts, as well as over 20 private funds. Since it pioneered REITs in Singapore with the listing of CapitaLand Mall Trust in 2002, CapitaLand’s REITs and business trusts have expanded to include Ascendas Real Estate Investment Trust, CapitaLand Commercial Trust, Ascott Residence Trust, CapitaLand Retail China Trust, Ascendas India Trust and CapitaLand Malaysia Mall Trust.		wikipedia
Capitaland largest city	large	 Big, of great size	Wikimedia disambiguation page	wikipedia
Capitaland largest city	city	A city is a large human settlement. It can be defined as a permanent and densely settled place with administratively defined boundaries whose members work primarily on non-agricultural tasks. Cities generally have extensive systems for housing, transportation, sanitation, utilities, land use, and communication. Their density facilitates interaction between people, government organisations and businesses, sometimes benefiting different parties in the process, such as improving efficiency of goods and service distribution. This concentration also can have significant negative consequences, such as forming urban heat islands, concentrating pollution, and stressing water supplies and other resources. Historically, city-dwellers have been a small proportion of humanity overall, but following two centuries of unprecedented and rapid urbanisation, roughly half of the world population now lives in cities, which has had profound consequences for global sustainability. Present-day cities usually form the core of larger metropolitan areas and urban areas—creating numerous commuters traveling towards city centres for employment, entertainment, and edification. However, in a world of intensifying globalisation, all cities are to varying degrees also connected globally beyond these regions. This increased influence means that cities also have significant influences on global issues, such as sustainable development, global warming and global health. Other important traits of cities besides population include the capital status and relative continued occupation of the city. For example, country capitals such as Abu Dhabi, Beijing, Berlin, Cairo, London, Moscow, Paris, Rome, Seoul, Tokyo, Taipei, and Washington, D.C. reflect their nation's identity. Some historic capitals, such as Kyoto, maintain their reflection of cultural identity even without modern capital status. Religious holy sites offer another example of capital status within a religion, Jerusalem, Mecca, and Varanasi each hold significance. The cities of Faiyum, Damascus, and Argos are among those laying claim to the longest continual inhabitation. In terms of relative age, the oldest cities in the Americas are Cholula near Puebla, Florés in Petén, and Acoma near Albuquerque, while the oldest capital cities in the Americas are Mexico City, Santo Domingo, and San Juan. Another example of relative age, is in the age of the oldest capital cities of the superpower and emerging superpower, they are the U.S. state capital of Santa Fe, New Mexico, and the Chinese prefecture capital of Xi'an, Shaanxi.	large permanent human settlement	wikipedia
Capitaland largest city	capitaland			wordnet
Capitaland largest city	largest	conspicuous in position or importance	big, large, prominent	wordnet
Capitaland largest city	city	people living in a large densely populated municipality	city, metropolis	wordnet
Capitaland largest city	large	A large is size	NA	GenericsKB
Capitaland largest city	city	A city is a municipality	NA	GenericsKB
Official languages	official languages	"An official language , also called state language , is a language given a special status in a particular country, state, or other jurisdiction. Typically a country's official language refers to the language used in government . The term ""official language"" does not typically refer to the language used by a people or country, but by its government, as ""the means of expression of a people cannot be changed by any law"". 178 countries of the world recognize an official language, 101 of them recognizing more than one. The government of Italy officialised Italian only in 1999, and some nations have never declared official languages at the national level. Other nations have declared non- indigenous official languages. ""The Philippines and parts of Africa live with a peculiar cultural paradox. Although the official languages may be French or English, these are not the languages most widely spoken by residents."" Many of the world's constitutions mention one or more official or national languages. Some countries use the official language designation to empower indigenous groups by giving them access to the government in their native languages. In countries that do not formally designate an official language, a de facto national language usually evolves. English is the most common official language, with recognized status in 51 countries. Arabic, French, and Spanish are also widely recognized. ° An official language that is also an indigenous language is called endoglossic , one that is not indigenous is exoglossic. An instance is Nigeria which has three endoglossic official languages. By this the country aims to protect the indigenous languages although at the same time recognising the English language as its lingua franca."	language given special status in some polity	wikipedia
Official languages	official	of or relating to an office	official	wordnet
Official languages	languages	a systematic means of communicating by the use of sounds or conventional symbols	language, linguistic_communication	wordnet
Official languages	official	Official is a worker	NA	GenericsKB
Official languages	language	Language aids people in adjusting as their culture changes	NA	GenericsKB
Recognized regional languages	recognize	Recall in memory refers to the mental process of retrieval of information from the past. Along with encoding and storage, it is one of the three core processes of memory. There are three main types of recall: free recall, cued recall and serial recall. Psychologists test these forms of recall as a way to study the memory processes of humans and animals. Two main theories of the process of recall are the two-stage theory and the theory of encoding specificity.	retrieval of events or information from the past	wikipedia
Recognized regional languages	regional	In geography, regions are areas that are broadly divided by physical characteristics , human impact characteristics , and the interaction of humanity and the environment . Geographic regions and sub-regions are mostly described by their imprecisely defined, and sometimes transitory boundaries, except in human geography, where jurisdiction areas such as national borders are defined in law. Apart from the global continental regions, there are also hydrospheric and atmospheric regions that cover the oceans, and discrete climates above the land and water masses of the planet. The land and water global regions are divided into subregions geographically bounded by large geological features that influence large-scale ecologies, such as plains and features. As a way of describing spatial areas, the concept of regions is important and widely used among the many branches of geography, each of which can describe areas in regional terms. For example, ecoregion is a term used in environmental geography, cultural region in cultural geography, bioregion in biogeography, and so on. The field of geography that studies regions themselves is called regional geography. In the fields of physical geography, ecology, biogeography, zoogeography, and environmental geography, regions tend to be based on natural features such as ecosystems or biotopes, biomes, drainage basins, natural regions, mountain ranges, soil types. Where human geography is concerned, the regions and subregions are described by the discipline of ethnography. A region has its own nature that could not be moved. The first nature is its natural environment . The second nature is its physical elements complex that were built by people in the past. The third nature is its socio-cultural context that could not be replaced by new immigrants.	2D or 3D defined space, mainly in terrestrial and astrophysics sciences	wikipedia
Recognized regional languages	language	"A language is a structured system of communication. Language, in a broader sense, is the method of communication that involves the use of – particularly human – languages. The scientific study of language is called linguistics. Questions concerning the philosophy of language, such as whether words can represent experience, have been debated at least since Gorgias and Plato in ancient Greece. Thinkers such as Rousseau have argued that language originated from emotions while others like Kant have held that it originated from rational and logical thought. 20th-century philosophers such as Wittgenstein argued that philosophy is really the study of language. Major figures in linguistics include Ferdinand de Saussure and Noam Chomsky. Estimates of the number of human languages in the world vary between 5,000 and 7,000. However, any precise estimate depends on the arbitrary distinction between languages and dialect. Natural languages are spoken or signed, but any language can be encoded into secondary media using auditory, visual, or tactile stimuli – for example, in writing, whistling, signing, or braille. This is because human language is modality-independent. Depending on philosophical perspectives regarding the definition of language and meaning, when used as a general concept, ""language"" may refer to the cognitive ability to learn and use systems of complex communication, or to describe the set of rules that makes up these systems, or the set of utterances that can be produced from those rules. All languages rely on the process of semiosis to relate signs to particular meanings. Oral, manual and tactile languages contain a phonological system that governs how symbols are used to form sequences known as words or morphemes, and a syntactic system that governs how words and morphemes are combined to form phrases and utterances. Human language has the properties of productivity and displacement, and relies entirely on social convention and learning. Its complex structure affords a much wider range of expressions than any known system of animal communication. Language is thought to have originated when early hominins started gradually changing their primate communication systems, acquiring the ability to form a theory of other minds and a shared intentionality. This development is sometimes thought to have coincided with an increase in brain volume, and many linguists see the structures of language as having evolved to serve specific communicative and social functions. Language is processed in many different locations in the human brain, but especially in Broca's and Wernicke's areas. Humans acquire language through social interaction in early childhood, and children generally speak fluently by approximately three years old. The use of language is deeply entrenched in human culture. Therefore, in addition to its strictly communicative uses, language also has many social and cultural uses, such as signifying group identity, social stratification, as well as social grooming and entertainment. Languages evolve and diversify over time, and the history of their evolution can be reconstructed by comparing modern languages to determine which traits their ancestral languages must have had in order for the later developmental stages to occur. A group of languages that descend from a common ancestor is known as a language family. The Indo-European family is the most widely spoken and includes languages as diverse as English, Russian and Hindi; the Sino- Tibetan family includes Mandarin and the other Chinese languages, Bodo and Tibetan; the Afro-Asiatic family includes Arabic, Somali, and Hebrew; the Bantu languages include Swahili, and Zulu, and hundreds of other languages spoken throughout Africa; and the Malayo-Polynesian languages include Indonesian, Malay, Tagalog, and hundreds of other languages spoken throughout the Pacific. The languages of the Dravidian family, spoken mostly in Southern India, include Tamil, Telugu and Kannada. Academic consensus holds that between 50% and 90% of languages spoken at the beginning of the 21st century will probably have become extinct by the year 2100."	capacity to communicate using signs, such as words or gestures	wikipedia
Recognized regional languages	recognized	grant credentials to	accredit, recognize, recognise	wordnet
Recognized regional languages	regional	characteristic of a region	regional	wordnet
Recognized regional languages	languages	the text of a popular song or musical-comedy number	lyric, words, language	wordnet
Recognized regional languages	regional	Region is the hiking region defined on the main hiking page 	NA	GenericsKB
Recognized regional languages	language	Language aids people in adjusting along with their culture as it changes	NA	GenericsKB
Ethnic groups  (2011)	ethnic groups	An ethnic group or ethnicity is a category of people who identify with each other, usually on the basis of presumed similarities such as a common language, ancestry, history, society, culture, nation, race or social treatment within their residing area. Ethnicity is often used synonymously with the term nation, particularly in cases of ethnic nationalism, and is separate from but related to the concept of races. Ethnicity is usually an inherited status based on the society in which one lives. Membership of an ethnic group tends to be defined by a shared cultural heritage, ancestry, origin myth, history, homeland, language or dialect, symbolic systems such as religion, mythology and ritual, cuisine, dressing style, art or physical appearance. Ethnic groups often continue to speak related languages and share a similar gene pool. By way of language shift, acculturation, adoption and religious conversion, it is sometimes possible for individuals or groups to leave one ethnic group and become part of another. The social construct that ethnic groups share a similar gene pool has been contradicted within the scientific community as evidenced by data finding more genetic variation within ethnic groups compared to between ethnic groups. The largest ethnic groups in modern times comprise more than one billion individuals each , while the smallest are limited to a few dozen individuals . Ethnic groups may be subdivided into subgroups or tribes, which over time may become separate ethnic groups themselves due to endogamy or physical isolation from the parent group. Conversely, formerly separate ethnicities can merge to form a pan-ethnicity and may eventually merge into one single ethnicity. Whether through division or amalgamation, the formation of a separate ethnic identity is referred to as ethnogenesis.	socially defined category of people who identify with each other	wikipedia
Ethnic groups  (2011)	ethnic	denoting or deriving from or distinctive of the ways of living built up by a group of people; - J.F.Kennedy	cultural, ethnic, ethnical	wordnet
Ethnic groups  (2011)	groups	any number of entities (members) considered as a unit	group, grouping	wordnet
Ethnic groups  (2011)	group	Group friendships of the same sex are most common	NA	GenericsKB
Religion  (2017)	religion	"Religion is a social-cultural system of designated behaviors and practices, morals, worldviews, texts, sanctified places, prophecies, ethics, or organizations, that relates humanity to supernatural, transcendental, or spiritual elements. However, there is no scholarly consensus over what precisely constitutes a religion. Different religions may or may not contain various elements ranging from the divine, sacred things, faith, a supernatural being or supernatural beings or ""some sort of ultimacy and transcendence that will provide norms and power for the rest of life"". Religious practices may include rituals, sermons, commemoration or veneration , sacrifices, festivals, feasts, trances, initiations, funerary services, matrimonial services, meditation, prayer, music, art, dance, public service, or other aspects of human culture. Religions have sacred histories and narratives, which may be preserved in sacred scriptures, and symbols and holy places, that aim mostly to give a meaning to life. Religions may contain symbolic stories, which are sometimes said by followers to be true, that have the side purpose of explaining the origin of life, the universe, and other things. Traditionally, faith, in addition to reason, has been considered a source of religious beliefs. There are an estimated 10,000 distinct religions worldwide. About 84% of the world's population is affiliated with Christianity, Islam, Hinduism, Buddhism, or some form of folk religion. The religiously unaffiliated demographic includes those who do not identify with any particular religion, atheists, and agnostics. While the religiously unaffiliated have grown globally, many of the religiously unaffiliated still have various religious beliefs. The study of religion encompasses a wide variety of academic disciplines, including theology, comparative religion and social scientific studies. Theories of religion offer various explanations for the origins and workings of religion, including the ontological foundations of religious being and belief."	sacred belief system	wikipedia
Religion  (2017)	religion	a strong belief in a supernatural power or powers that control human destiny	religion, faith, religious_belief	wordnet
Religion  (2017)	religion	the belief in and worship of a superhuman controlling power, especially a personal God or gods.	NA	owlbot
Religion  (2017)	religion	Religion addresses moral issues	NA	GenericsKB
Demonym(s)	demonym	"A demonym or gentilic is a word that identifies residents or natives of a particular place, usually derived from the name of the place or that of an ethnic group. As a sub-field of anthroponymy, the study of demonyms is called demonymy or demonymics. Examples of demonyms include Cochabambino , for someone from the city of Cochabamba; American for a person from the country called the United States of America; and Swahili , for a person of the Swahili coast. Demonyms do not always clearly distinguish place of origin or ethnicity from place of residence or citizenship, and many demonyms overlap with the ethnonym for the ethnically dominant group of a region. Thus a Thai may be any resident or citizen of Thailand of any ethnic group, or more narrowly a member of the Thai people. Conversely, some groups of people may be associated with multiple demonyms. For example, a native of the United Kingdom may be called a British person , a Briton or, informally, a Brit. In some languages, a demonym may be borrowed from another language as a nickname or descriptive adjective for a group of people: for example, ""Québécois"" is commonly used in English for a native of Quebec . In English, demonyms are always capitalized. Often, they are the same as the adjectival form of the place, e.g. Egyptian , Japanese , or Greek , though significant exceptions exist; for instance, the adjectival form of Spain is ""Spanish"", but the demonym is ""Spaniards "". English commonly uses national demonyms such as ""Ethiopian"" or ""Guatemalan"", but the usage of local demonyms such as ""Chicagoan"", ""Okie"", or ""Parisian"", is rare. Many local demonyms are rarely used and many places, especially smaller towns and cities, lack a commonly used and accepted demonym altogether. Often, in practice, the demonym for states, provinces or cities is simply the name of the place, treated as an adjective; for instance, Kennewick Man, Saskatchewan Open, and New York minute, but Russia n olive, the Australia n Open, and Chin ese checkers."	name for a resident of a locality	wikipedia
Demonym(s)	demonym			wordnet
Government	government	A government is the system or group of people governing an organized community, often a state, but also other entities like for example companies, especially in the case of colonial companies. In the case of its broad associative definition, government normally consists of legislature, executive, and judiciary. Government is a means by which organizational policies are enforced, as well as a mechanism for determining policy. Each government has a kind of constitution, a statement of its governing principles and philosophy. Typically the philosophy chosen is some balance between the principle of individual freedom and the idea of absolute state authority . While all types of organizations have governance, the term government is often used more specifically, to refer to the approximately 200 independent national governments and subsidiary organizations globally. Historically prevalent forms of government include monarchy, aristocracy, timocracy, oligarchy, democracy, theocracy and tyranny. The main aspect of any philosophy of government is how political power is obtained, with the two main forms being electoral contest and hereditary succession. Libertarianism and anarchism are political ideologies that seek to limit or abolish government, finding government disruptive to self organization and freedom.	system or group of people governing an organized community, often a state	wikipedia
Government	government	the study of government of states and other political units	politics, political_science, government	wordnet
Government	government	the group of people with the authority to govern a country or state; a particular ministry in office.	NA	owlbot
Government	government	Government also carries an enormous load of social responsibility	NA	GenericsKB
President	president	"Five ships and one shore establishment of the Royal Navy have been named HMS President , after the office of president meaning ""one who presides over an assembly"""	Wikimedia disambiguation page	wikipedia
President	president	the person who holds the office of head of state of the United States government	President_of_the_United_States, United_States_President, President, Chief_Executive	wordnet
President	president	the elected head of a republican state.	NA	owlbot
President	president	Presidents are defined as heads of state	NA	GenericsKB
1st Vice-President	vice	Vice is a practice, behaviour, or habit generally considered immoral, sinful, criminal, rude, taboo, depraved, or degrading in the associated society. In more minor usage, vice can refer to a fault, a negative character trait, a defect, an infirmity, or a bad or unhealthy habit. Vices are usually associated with a transgression in a person's character or temperament rather than their morality. Synonyms for vice include fault, sin, depravity, iniquity, wickedness, and corruption. The opposite of vice is virtue.	practice or behavior or habit generally considered immoral, depraved, or degrading in the associated society	wikipedia
1st Vice-President	president	Four ships and two shore establishments of the Royal Navy have been named HMS Buzzard after the bird, the buzzard:	Wikimedia disambiguation page	wikipedia
1st Vice-President	st			wordnet
1st Vice-President	vice	moral weakness	frailty, vice	wordnet
1st Vice-President	president	the chief executive of a republic	president	wordnet
1st Vice-President	vice	Vice is located in workshops	NA	GenericsKB
1st Vice-President	president	President is a administrator	NA	GenericsKB
2nd Vice-President	nd	APA Style is a writing style and format for academic documents such as scholarly journal articles and books	Academic format of citation made by American Psychological Association (APA) wwrt	wikipedia
2nd Vice-President	vice	Vice is a practice, behaviour, or habit generally considered immoral, sinful, criminal, rude, taboo, depraved, or degrading in the associated society. In more minor usage, vice can refer to a fault, a negative character trait, a defect, an infirmity, or a bad or unhealthy habit. Vices are usually associated with a transgression in a person's character or temperament rather than their morality. Synonyms for vice include fault, sin, depravity, iniquity, wickedness, and corruption. The opposite of vice is virtue.	practice or behavior or habit generally considered immoral, depraved, or degrading in the associated society	wikipedia
2nd Vice-President	president	Four ships and two shore establishments of the Royal Navy have been named HMS Buzzard after the bird, the buzzard:	Wikimedia disambiguation page	wikipedia
2nd Vice-President	nd	a state of north central United States bordering on Canada	North_Dakota, Peace_Garden_State, ND	wordnet
2nd Vice-President	vice	a specific form of evildoing	vice	wordnet
2nd Vice-President	president	the person who holds the office of head of state of the United States government	President_of_the_United_States, United_States_President, President, Chief_Executive	wordnet
2nd Vice-President	vice	Vice is located in workshops	NA	GenericsKB
2nd Vice-President	president	Presidents are defined as heads of state	NA	GenericsKB
